2019,1,AA,American Airlines Network,CAE,"Columbia, SC: Columbia Metropolitan",59.00,10.00,5.10,0.35,1.87,0.00,2.68,0.00,0.00,880.00,161.00,11.00,123.00,0.00,585.00
2019,1,AA,American Airlines Network,CHS,"Charleston, SC: Charleston AFB/International",131.00,31.00,13.62,0.00,4.18,0.00,13.21,0.00,0.00,1735.00,807.00,0.00,138.00,0.00,790.00
2019,1,AA,American Airlines Network,CLE,"Cleveland, OH: Cleveland-Hopkins International",251.00,34.00,13.39,1.12,12.93,0.00,6.56,4.00,0.00,1709.00,1021.00,57.00,324.00,0.00,307.00
2019,1,AA,American Airlines Network,CLT,"Charlotte, NC: Charlotte Douglas International",8223.00,1132.00,300.46,36.46,359.62,0.43,435.04,75.00,2.00,73378.00,30251.00,3090.00,11787.00,10.00,28240.00
2019,1,AA,American Airlines Network,CMH,"Columbus, OH: John Glenn Columbus International",219.00,42.00,16.46,0.39,8.98,0.00,16.17,4.00,0.00,1945.00,679.00,29.00,252.00,0.00,985.00
2019,1,AA,American Airlines Network,COS,"Colorado Springs, CO: City of Colorado Springs Municipal",122.00,21.00,12.78,0.25,3.53,0.00,4.43,0.00,1.00,914.00,609.00,13.00,104.00,0.00,188.00
2019,1,AA,American Airlines Network,CVG,"Cincinnati, OH: Cincinnati/Northern Kentucky International",62.00,8.00,2.77,0.27,0.51,0.00,4.45,1.00,0.00,260.00,90.00,8.00,15.00,0.00,147.00
2019,1,AA,American Airlines Network,DCA,"Washington, DC: Ronald Reagan Washington National",2024.00,308.00,89.01,25.14,88.02,0.08,105.75,85.00,14.00,19722.00,5654.00,1920.00,3777.00,11.00,8360.00
2019,1,AA,American Airlines Network,DEN,"Denver, CO: Denver International",803.00,157.00,56.78,8.76,52.83,0.00,38.64,10.00,1.00,7422.00,3017.00,562.00,1631.00,0.00,2212.00
2019,1,AA,American Airlines Network,DFW,"Dallas/Fort Worth, TX: Dallas/Fort Worth International",11899.00,2106.00,503.59,87.73,815.23,0.31,699.14,92.00,9.00,128680.00,48609.00,5318.00,27627.00,31.00,47095.00
2019,1,AA,American Airlines Network,DSM,"Des Moines, IA: Des Moines International",152.00,20.00,10.55,0.35,6.03,0.00,3.08,0.00,1.00,825.00,501.00,8.00,114.00,0.00,202.00
2019,1,AA,American Airlines Network,DTW,"Detroit, MI: Detroit Metro Wayne County",461.00,81.00,34.43,3.25,21.55,0.23,21.55,10.00,4.00,3338.00,1726.00,211.00,610.00,5.00,786.00
2019,1,AA,American Airlines Network,EGE,"Eagle, CO: Eagle County Regional",205.00,76.00,26.83,4.84,35.06,0.00,9.27,5.00,2.00,7365.00,4089.00,307.00,1489.00,0.00,1480.00
2019,1,AA,American Airlines Network,ELP,"El Paso, TX: El Paso International",147.00,41.00,17.28,2.77,13.33,0.00,7.63,0.00,0.00,1573.00,830.00,97.00,356.00,0.00,290.00
2019,1,AA,American Airlines Network,EWR,"Newark, NJ: Newark Liberty International",580.00,197.00,30.71,8.57,129.61,0.86,27.25,9.00,3.00,11259.00,1697.00,377.00,7206.00,18.00,1961.00
2019,1,AA,American Airlines Network,FAT,"Fresno, CA: Fresno Yosemite International",65.00,11.00,7.33,0.56,1.36,0.00,1.76,0.00,0.00,362.00,224.00,24.00,33.00,0.00,81.00
2019,1,AA,American Airlines Network,FLL,"Fort Lauderdale, FL: Fort Lauderdale-Hollywood International",559.00,128.00,39.86,5.79,48.50,0.64,33.21,7.00,3.00,5078.00,1760.00,265.00,1520.00,18.00,1515.00
2019,1,AA,American Airlines Network,GEG,"Spokane, WA: Spokane International",60.00,7.00,3.45,0.00,1.37,0.00,2.18,0.00,0.00,248.00,149.00,0.00,42.00,0.00,57.00
2019,1,AA,American Airlines Network,GRR,"Grand Rapids, MI: Gerald R. Ford International",63.00,10.00,0.64,0.14,4.21,0.00,5.01,0.00,1.00,385.00,16.00,3.00,142.00,0.00,224.00
2019,1,AA,American Airlines Network,GSO,"Greensboro/High Point, NC: Piedmont Triad International",28.00,5.00,2.41,0.00,1.59,0.00,1.00,0.00,0.00,180.00,94.00,0.00,37.00,0.00,49.00
2019,1,AA,American Airlines Network,GSP,"Greer, SC: Greenville-Spartanburg International",62.00,12.00,5.70,0.00,2.01,0.00,4.29,0.00,0.00,530.00,284.00,0.00,40.00,0.00,206.00
2019,1,AA,American Airlines Network,GUC,"Gunnison, CO: Gunnison-Crested Butte Regional",38.00,12.00,5.95,0.09,4.44,0.00,1.53,0.00,0.00,673.00,469.00,2.00,163.00,0.00,39.00
2019,1,AA,American Airlines Network,HDN,"Hayden, CO: Yampa Valley",38.00,8.00,2.74,0.00,2.72,0.00,2.54,0.00,0.00,537.00,149.00,0.00,81.00,0.00,307.00
2019,1,AA,American Airlines Network,HNL,"Honolulu, HI: Daniel K Inouye International",217.00,28.00,8.58,0.00,14.12,0.00,5.31,0.00,1.00,2493.00,1116.00,0.00,315.00,0.00,1062.00
2019,1,AA,American Airlines Network,IAD,"Washington, DC: Washington Dulles International",194.00,34.00,14.78,0.38,9.91,0.00,8.93,0.00,2.00,1536.00,828.00,8.00,296.00,0.00,404.00
2019,1,AA,American Airlines Network,IAH,"Houston, TX: George Bush Intercontinental/Houston",747.00,151.00,56.57,4.94,49.67,0.16,39.66,8.00,1.00,6660.00,2674.00,262.00,1488.00,4.00,2232.00
2019,1,AA,American Airlines Network,ICT,"Wichita, KS: Wichita Dwight D Eisenhower National",65.00,10.00,5.63,0.00,1.75,0.00,2.61,0.00,0.00,403.00,179.00,0.00,60.00,0.00,164.00
2019,1,AA,American Airlines Network,ILM,"Wilmington, NC: Wilmington International",81.00,2.00,1.35,0.00,0.65,0.00,0.00,1.00,0.00,121.00,106.00,0.00,15.00,0.00,0.00
2019,1,AA,American Airlines Network,IND,"Indianapolis, IN: Indianapolis International",305.00,65.00,30.08,2.36,11.60,0.00,20.95,5.00,0.00,4494.00,2202.00,166.00,363.00,0.00,1763.00
2019,1,AA,American Airlines Network,JAC,"Jackson, WY: Jackson Hole",73.00,32.00,7.28,3.75,17.60,0.00,3.36,1.00,3.00,2194.00,825.00,412.00,834.00,0.00,123.00
2019,1,AA,American Airlines Network,JAX,"Jacksonville, FL: Jacksonville International",328.00,52.00,27.31,0.44,12.61,1.30,10.34,0.00,0.00,2577.00,1712.00,22.00,372.00,24.00,447.00
2019,1,AA,American Airlines Network,JFK,"New York, NY: John F. Kennedy International",1474.00,257.00,81.62,6.02,97.13,0.26,71.97,13.00,4.00,17713.00,5529.00,623.00,4452.00,5.00,7104.00
2019,1,AA,American Airlines Network,KOA,"Kona, HI: Ellison Onizuka Kona International at Keahole",76.00,7.00,1.67,0.00,4.38,0.00,0.96,0.00,0.00,173.00,34.00,0.00,116.00,0.00,23.00
2019,1,AA,American Airlines Network,LAS,"Las Vegas, NV: McCarran International",1183.00,235.00,75.61,10.50,87.18,1.55,60.16,12.00,2.00,11276.00,4051.00,453.00,2898.00,42.00,3832.00
2019,1,AA,American Airlines Network,LAX,"Los Angeles, CA: Los Angeles International",3338.00,570.00,169.95,31.93,238.25,1.00,128.86,23.00,9.00,30819.00,9393.00,2724.00,7228.00,178.00,11296.00
2019,1,AA,American Airlines Network,LGA,"New York, NY: LaGuardia",1825.00,540.00,81.68,25.53,321.12,0.09,111.57,81.00,1.00,30372.00,4732.00,1839.00,15813.00,3.00,7985.00
2019,1,AA,American Airlines Network,LIH,"Lihue, HI: Lihue Airport",79.00,7.00,1.24,0.00,3.83,0.00,1.92,0.00,0.00,287.00,90.00,0.00,128.00,0.00,69.00
2019,1,AA,American Airlines Network,MCI,"Kansas City, MO: Kansas City International",403.00,78.00,32.41,4.35,19.52,0.00,21.72,5.00,2.00,3424.00,1464.00,227.00,643.00,0.00,1090.00
2019,1,AA,American Airlines Network,MCO,"Orlando, FL: Orlando International",1593.00,269.00,103.82,16.34,81.70,0.94,66.19,17.00,1.00,12603.00,4792.00,692.00,2769.00,46.00,4304.00
2019,1,AA,American Airlines Network,MDT,"Harrisburg, PA: Harrisburg International",55.00,5.00,2.00,1.00,1.09,0.00,0.91,1.00,0.00,149.00,55.00,25.00,21.00,0.00,48.00
2019,1,AA,American Airlines Network,MEM,"Memphis, TN: Memphis International",228.00,42.00,17.55,0.41,8.43,0.67,14.93,1.00,0.00,1819.00,791.00,15.00,279.00,33.00,701.00
2019,1,AA,American Airlines Network,MHT,"Manchester, NH: Manchester-Boston Regional",55.00,4.00,0.78,0.00,0.30,0.00,2.92,0.00,0.00,313.00,43.00,0.00,15.00,0.00,255.00
2019,1,AA,American Airlines Network,MIA,"Miami, FL: Miami International",4641.00,821.00,240.68,42.16,309.36,1.27,227.53,44.00,7.00,50983.00,19605.00,2772.00,11002.00,826.00,16778.00
2019,1,AA,American Airlines Network,MKE,"Milwaukee, WI: General Mitchell International",114.00,13.00,7.04,0.00,0.95,0.00,5.02,5.00,0.00,637.00,212.00,0.00,39.00,0.00,386.00
2019,1,AA,American Airlines Network,MSP,"Minneapolis, MN: Minneapolis-St Paul International",673.00,129.00,44.25,13.81,30.16,0.14,40.63,29.00,1.00,6930.00,2667.00,748.00,1047.00,10.00,2458.00
2019,1,AA,American Airlines Network,MSY,"New Orleans, LA: Louis Armstrong New Orleans International",665.00,129.00,37.18,9.97,41.64,1.60,38.61,8.00,0.00,6132.00,2009.00,476.00,1321.00,41.00,2285.00
2019,1,AA,American Airlines Network,MTJ,"Montrose/Delta, CO: Montrose Regional",35.00,12.00,3.32,0.05,7.77,0.00,0.86,0.00,1.00,419.00,102.00,2.00,284.00,0.00,31.00
2019,1,AA,American Airlines Network,MYR,"Myrtle Beach, SC: Myrtle Beach International",26.00,6.00,4.38,0.00,0.06,0.00,1.56,0.00,0.00,303.00,196.00,0.00,1.00,0.00,106.00
2019,1,AA,American Airlines Network,OAK,"Oakland, CA: Metropolitan Oakland International",110.00,13.00,6.08,0.00,4.63,0.00,2.29,0.00,1.00,554.00,275.00,0.00,125.00,0.00,154.00
2019,1,AA,American Airlines Network,OGG,"Kahului, HI: Kahului Airport",137.00,20.00,6.21,0.00,9.57,0.00,4.21,0.00,0.00,729.00,168.00,0.00,234.00,0.00,327.00
2019,1,AA,American Airlines Network,OKC,"Oklahoma City, OK: Will Rogers World",175.00,38.00,17.78,0.09,6.61,0.00,13.52,2.00,0.00,1989.00,1114.00,3.00,239.00,0.00,633.00
2019,1,AA,American Airlines Network,OMA,"Omaha, NE: Eppley Airfield",167.00,20.00,11.53,0.37,6.17,0.00,1.93,1.00,0.00,774.00,433.00,7.00,123.00,0.00,211.00
2019,1,AA,American Airlines Network,ONT,"Ontario, CA: Ontario International",203.00,39.00,13.93,0.92,15.05,0.00,9.10,0.00,0.00,1204.00,478.00,46.00,345.00,0.00,335.00
2019,1,AA,American Airlines Network,ORD,"Chicago, IL: Chicago O'Hare International",5377.00,1170.00,188.73,41.45,635.01,2.63,302.18,464.00,28.00,92755.00,14139.00,4686.00,48418.00,68.00,25444.00
2019,1,AA,American Airlines Network,ORF,"Norfolk, VA: Norfolk International",161.00,33.00,8.59,0.00,15.41,0.00,9.00,0.00,0.00,1288.00,410.00,0.00,384.00,0.00,494.00
2019,1,AA,American Airlines Network,PBI,"West Palm Beach/Palm Beach, FL: Palm Beach International",442.00,90.00,22.17,6.00,36.33,0.00,25.50,8.00,0.00,4816.00,1195.00,326.00,1170.00,0.00,2125.00
2019,1,AA,American Airlines Network,PDX,"Portland, OR: Portland International",307.00,55.00,19.85,2.98,15.59,0.00,16.59,3.00,1.00,2485.00,892.00,411.00,494.00,0.00,688.00
2019,1,AA,American Airlines Network,PHL,"Philadelphia, PA: Philadelphia International",3931.00,479.00,170.10,23.77,132.89,1.44,150.80,74.00,2.00,31382.00,14843.00,1585.00,4010.00,50.00,10894.00
2019,1,AA,American Airlines Network,PHX,"Phoenix, AZ: Phoenix Sky Harbor International",4796.00,705.00,216.92,27.62,257.39,0.75,202.31,48.00,5.00,41174.00,14878.00,2552.00,7903.00,35.00,15806.00
2019,1,AA,American Airlines Network,PIT,"Pittsburgh, PA: Pittsburgh International",456.00,75.00,27.91,7.53,16.23,0.00,23.33,13.00,0.00,4253.00,1465.00,514.00,595.00,0.00,1679.00
2019,1,AA,American Airlines Network,PNS,"Pensacola, FL: Pensacola International",66.00,11.00,3.68,0.00,3.05,0.00,4.27,1.00,2.00,405.00,125.00,0.00,105.00,0.00,175.00
2019,1,AA,American Airlines Network,PSP,"Palm Springs, CA: Palm Springs International",155.00,37.00,13.99,3.71,10.86,0.00,8.44,5.00,1.00,2092.00,1051.00,175.00,328.00,0.00,538.00
2019,1,AA,American Airlines Network,PVD,"Providence, RI: Theodore Francis Green State",168.00,23.00,9.66,0.00,6.20,0.00,7.14,4.00,1.00,1684.00,870.00,0.00,139.00,0.00,675.00
2019,1,AA,American Airlines Network,PWM,"Portland, ME: Portland International Jetport",149.00,17.00,7.55,0.00,5.29,0.00,4.16,5.00,0.00,716.00,297.00,0.00,198.00,0.00,221.00
2019,1,AA,American Airlines Network,RDU,"Raleigh/Durham, NC: Raleigh-Durham International",735.00,113.00,44.73,4.68,29.60,0.35,33.64,11.00,0.00,4990.00,2157.00,179.00,844.00,6.00,1804.00
2019,1,AA,American Airlines Network,RIC,"Richmond, VA: Richmond International",231.00,34.00,16.90,0.46,5.13,1.00,10.51,1.00,0.00,1487.00,760.00,11.00,145.00,16.00,555.00
2019,1,AA,American Airlines Network,RNO,"Reno, NV: Reno/Tahoe International",97.00,18.00,4.05,0.24,5.16,0.00,8.55,0.00,0.00,780.00,174.00,8.00,166.00,0.00,432.00
2019,1,AA,American Airlines Network,ROC,"Rochester, NY: Greater Rochester International",25.00,3.00,2.20,0.00,0.80,0.00,0.00,0.00,0.00,130.00,118.00,0.00,12.00,0.00,0.00
2019,1,AA,American Airlines Network,RSW,"Fort Myers, FL: Southwest Florida International",533.00,89.00,22.37,10.23,27.83,0.00,28.57,14.00,5.00,3940.00,809.00,435.00,890.00,0.00,1806.00
2019,1,AA,American Airlines Network,SAN,"San Diego, CA: San Diego International",681.00,134.00,39.63,8.07,55.85,0.00,30.45,7.00,3.00,5341.00,1820.00,311.00,1521.00,0.00,1689.00
2019,1,AA,American Airlines Network,SAT,"San Antonio, TX: San Antonio International",754.00,111.00,44.04,6.42,18.75,0.00,41.79,6.00,0.00,5606.00,2288.00,318.00,675.00,0.00,2325.00
2019,1,AA,American Airlines Network,SAV,"Savannah, GA: Savannah/Hilton Head International",82.00,14.00,6.25,0.22,2.11,0.00,5.43,0.00,0.00,671.00,386.00,14.00,48.00,0.00,223.00
2019,1,AA,American Airlines Network,SDF,"Louisville, KY: Louisville Muhammad Ali International",26.00,0.00,0.00,0.00,0.00,0.00,0.00,0.00,0.00,0.00,0.00,0.00,0.00,0.00,0.00
2019,1,AA,American Airlines Network,SEA,"Seattle, WA: Seattle/Tacoma International",558.00,98.00,37.91,7.81,25.45,0.31,26.52,6.00,4.00,5041.00,2072.00,559.00,761.00,12.00,1637.00
2019,1,AA,American Airlines Network,SFO,"San Francisco, CA: San Francisco International",1066.00,290.00,55.20,11.78,163.78,0.00,59.25,19.00,7.00,19005.00,3502.00,596.00,9868.00,0.00,5039.00
2019,1,AA,American Airlines Network,SJC,"San Jose, CA: Norman Y. Mineta San Jose International",298.00,63.00,20.80,2.34,22.43,0.00,17.43,6.00,0.00,2404.00,946.00,83.00,653.00,0.00,722.00
2019,1,AA,American Airlines Network,SJU,"San Juan, PR: Luis Munoz Marin International",368.00,77.00,36.90,0.92,20.52,1.22,17.44,0.00,0.00,4038.00,2020.00,102.00,734.00,35.00,1147.00
2019,1,AA,American Airlines Network,SLC,"Salt Lake City, UT: Salt Lake City International",421.00,100.00,35.87,4.74,30.60,0.00,28.79,2.00,0.00,4376.00,1646.00,299.00,743.00,0.00,1688.00
2019,1,AA,American Airlines Network,SMF,"Sacramento, CA: Sacramento International",339.00,45.00,23.93,0.63,6.22,0.00,14.23,1.00,1.00,2012.00,1068.00,18.00,198.00,0.00,728.00
2019,1,AA,American Airlines Network,SNA,"Santa Ana, CA: John Wayne Airport-Orange County",484.00,81.00,30.17,3.92,26.79,0.00,20.12,5.00,1.00,3455.00,1427.00,175.00,697.00,0.00,1156.00
2019,1,AA,American Airlines Network,SRQ,"Sarasota/Bradenton, FL: Sarasota/Bradenton International",61.00,9.00,2.59,0.00,3.47,0.93,2.00,0.00,0.00,280.00,75.00,0.00,72.00,14.00,119.00
2019,1,AA,American Airlines Network,STL,"St. Louis, MO: St Louis Lambert International",526.00,113.00,44.58,5.19,26.53,0.07,36.63,11.00,1.00,6123.00,2456.00,256.00,890.00,2.00,2519.00
2019,1,AA,American Airlines Network,STT,"Charlotte Amalie, VI: Cyril E King",116.00,35.00,17.36,0.00,13.48,0.00,4.16,0.00,0.00,1992.00,997.00,0.00,406.00,0.00,589.00
2019,1,AA,American Airlines Network,STX,"Christiansted, VI: Henry E. Rohlsen",66.00,11.00,5.64,0.00,1.82,0.44,3.10,0.00,0.00,277.00,169.00,0.00,38.00,7.00,63.00
2019,1,AA,American Airlines Network,SYR,"Syracuse, NY: Syracuse Hancock International",53.00,11.00,3.64,0.00,1.02,0.00,6.34,1.00,1.00,344.00,103.00,0.00,25.00,0.00,216.00
2019,1,AA,American Airlines Network,TPA,"Tampa, FL: Tampa International",1139.00,220.00,76.64,12.09,69.63,0.22,61.42,11.00,4.00,9889.00,3155.00,862.00,2268.00,22.00,3582.00
2019,1,AA,American Airlines Network,TUL,"Tulsa, OK: Tulsa International",242.00,39.00,20.02,0.02,6.16,0.00,12.80,1.00,0.00,2398.00,1193.00,1.00,175.00,0.00,1029.00
2019,1,AA,American Airlines Network,TUS,"Tucson, AZ: Tucson International",356.00,75.00,28.56,7.96,15.48,0.24,22.76,4.00,0.00,3899.00,1869.00,313.00,476.00,8.00,1233.00
2019,1,AA,American Airlines Network,VPS,"Valparaiso, FL: Eglin AFB Destin Fort Walton Beach",91.00,18.00,10.03,3.13,2.35,0.00,2.49,1.00,2.00,1002.00,510.00,160.00,90.00,0.00,242.00
2019,1,AA,American Airlines Network,XNA,"Fayetteville, AR: Northwest Arkansas Regional",49.00,2.00,2.00,0.00,0.00,0.00,0.00,0.00,0.00,47.00,47.00,0.00,0.00,0.00,0.00
2019,1,AS,Alaska Airlines Network,ABQ,"Albuquerque, NM: Albuquerque International Sunport",31.00,1.00,0.00,0.00,1.00,0.00,0.00,0.00,0.00,24.00,0.00,0.00,24.00,0.00,0.00
2019,1,AS,Alaska Airlines Network,ADK,"Adak Island, AK: Adak",9.00,1.00,1.00,0.00,0.00,0.00,0.00,0.00,0.00,36.00,36.00,0.00,0.00,0.00,0.00
2019,1,AS,Alaska Airlines Network,ADQ,"Kodiak, AK: Kodiak Airport",53.00,12.00,7.88,0.94,0.18,0.00,3.00,0.00,0.00,677.00,367.00,145.00,18.00,0.00,147.00
2019,1,AS,Alaska Airlines Network,ANC,"Anchorage, AK: Ted Stevens Anchorage International",1179.00,125.00,31.90,5.82,36.79,1.80,48.70,24.00,2.00,5993.00,1553.00,319.00,1079.00,38.00,3004.00
2019,1,AS,Alaska Airlines Network,ATL,"Atlanta, GA: Hartsfield-Jackson Atlanta International",36.00,3.00,0.89,0.00,1.11,0.00,1.00,0.00,0.00,61.00,15.00,0.00,19.00,0.00,27.00
2019,1,AS,Alaska Airlines Network,AUS,"Austin, TX: Austin - Bergstrom International",134.00,50.00,11.81,0.00,23.27,0.00,14.92,0.00,0.00,3034.00,836.00,0.00,1017.00,0.00,1181.00
2019,1,AS,Alaska Airlines Network,BET,"Bethel, AK: Bethel Airport",70.00,8.00,1.75,1.82,1.41,0.00,3.01,4.00,1.00,543.00,144.00,170.00,48.00,0.00,181.00
2019,1,AS,Alaska Airlines Network,BLI,"Bellingham, WA: Bellingham International",64.00,4.00,1.79,0.00,1.21,0.00,1.00,1.00,0.00,123.00,66.00,0.00,32.00,0.00,25.00
2019,1,AS,Alaska Airlines Network,BNA,"Nashville, TN: Nashville International",63.00,13.00,2.81,0.00,5.75,0.00,4.44,0.00,0.00,960.00,297.00,0.00,310.00,0.00,353.00
2019,1,AS,Alaska Airlines Network,BOI,"Boise, ID: Boise Air Terminal",32.00,2.00,0.00,0.00,1.56,0.00,0.44,0.00,0.00,34.00,0.00,0.00,26.00,0.00,8.00
2019,1,AS,Alaska Airlines Network,BOS,"Boston, MA: Logan International",213.00,33.00,8.39,0.00,21.06,0.00,3.55,7.00,0.00,2192.00,415.00,0.00,1670.00,0.00,107.00
2019,1,AS,Alaska Airlines Network,BRW,"Barrow, AK: Wiley Post/Will Rogers Memorial",62.00,5.00,0.07,1.00,1.06,0.00,2.87,2.00,2.00,122.00,2.00,27.00,32.00,0.00,61.00
2019,1,AS,Alaska Airlines Network,BUR,"Burbank, CA: Bob Hope",74.00,7.00,2.00,0.00,2.14,0.00,2.86,0.00,0.00,190.00,72.00,0.00,50.00,0.00,68.00
2019,1,AS,Alaska Airlines Network,BWI,"Baltimore, MD: Baltimore/Washington International Thurgood Marshall",114.00,20.00,7.09,0.00,11.63,0.00,1.28,0.00,0.00,809.00,368.00,0.00,393.00,0.00,48.00
2019,1,AS,Alaska Airlines Network,CDV,"Cordova, AK: Merle K Mudhole Smith",60.00,8.00,2.42,1.00,2.01,0.00,2.57,4.00,1.00,391.00,158.00,24.00,71.00,0.00,138.00
2019,1,AS,Alaska Airlines Network,CHS,"Charleston, SC: Charleston AFB/International",22.00,1.00,1.00,0.00,0.00,0.00,0.00,0.00,0.00,88.00,88.00,0.00,0.00,0.00,0.00
2019,1,QX,Horizon Air,LAS,"Las Vegas, NV: McCarran International",25.00,7.00,1.07,0.72,4.25,0.00,0.96,0.00,0.00,266.00,46.00,34.00,120.00,0.00,66.00
2019,1,QX,Horizon Air,LAX,"Los Angeles, CA: Los Angeles International",86.00,17.00,6.42,2.15,5.95,0.00,2.49,0.00,1.00,963.00,590.00,44.00,158.00,0.00,171.00
2019,1,QX,Horizon Air,MFR,"Medford, OR: Rogue Valley International - Medford",233.00,33.00,12.55,3.48,9.32,0.00,7.65,3.00,0.00,1261.00,502.00,207.00,260.00,0.00,292.00
2019,1,QX,Horizon Air,MSO,"Missoula, MT: Missoula International",158.00,26.00,7.69,0.74,12.91,0.00,4.66,0.00,1.00,961.00,407.00,20.00,288.00,0.00,246.00
2019,1,QX,Horizon Air,MSP,"Minneapolis, MN: Minneapolis-St Paul International",6.00,2.00,0.00,0.00,2.00,0.00,0.00,0.00,0.00,47.00,0.00,0.00,47.00,0.00,0.00
2019,1,QX,Horizon Air,OAK,"Oakland, CA: Metropolitan Oakland International",111.00,15.00,8.63,0.00,2.93,0.00,3.44,0.00,0.00,710.00,477.00,0.00,78.00,0.00,155.00
2019,1,QX,Horizon Air,OKC,"Oklahoma City, OK: Will Rogers World",31.00,11.00,3.17,0.00,7.83,0.00,0.00,0.00,0.00,326.00,102.00,0.00,224.00,0.00,0.00
2019,1,QX,Horizon Air,ONT,"Ontario, CA: Ontario International",92.00,27.00,10.96,0.00,11.84,0.00,4.20,0.00,0.00,992.00,521.00,0.00,345.00,0.00,126.00
2019,1,QX,Horizon Air,PDX,"Portland, OR: Portland International",1841.00,215.00,71.62,5.72,56.42,0.42,80.82,25.00,4.00,9598.00,2995.00,308.00,1808.00,8.00,4479.00
2019,1,QX,Horizon Air,PHX,"Phoenix, AZ: Phoenix Sky Harbor International",25.00,3.00,1.40,0.00,1.60,0.00,0.00,0.00,0.00,107.00,81.00,0.00,26.00,0.00,0.00
2019,1,QX,Horizon Air,PSC,"Pasco/Kennewick/Richland, WA: Tri Cities",209.00,40.00,10.00,2.89,15.15,0.00,11.95,3.00,1.00,1462.00,353.00,302.00,378.00,0.00,429.00
2019,1,QX,Horizon Air,PSP,"Palm Springs, CA: Palm Springs International",5.00,1.00,0.00,0.00,1.00,0.00,0.00,0.00,0.00,16.00,0.00,0.00,16.00,0.00,0.00
2019,1,QX,Horizon Air,PUW,"Pullman, WA: Pullman Moscow Regional",120.00,21.00,8.15,4.46,4.98,0.00,3.41,18.00,1.00,839.00,312.00,258.00,130.00,0.00,139.00
2019,1,QX,Horizon Air,RDM,"Bend/Redmond, OR: Roberts Field",298.00,45.00,13.41,2.65,18.57,0.00,10.37,19.00,1.00,1677.00,423.00,171.00,490.00,0.00,593.00
2019,1,QX,Horizon Air,RNO,"Reno, NV: Reno/Tahoe International",196.00,24.00,13.09,0.00,7.48,0.00,3.43,0.00,0.00,979.00,531.00,0.00,277.00,0.00,171.00
2019,1,QX,Horizon Air,SAN,"San Diego, CA: San Diego International",54.00,12.00,2.00,0.00,5.52,0.00,4.48,0.00,0.00,418.00,104.00,0.00,169.00,0.00,145.00
2019,1,QX,Horizon Air,SBA,"Santa Barbara, CA: Santa Barbara Municipal",31.00,6.00,1.14,0.00,3.90,0.00,0.96,0.00,0.00,150.00,33.00,0.00,90.00,0.00,27.00
2019,1,QX,Horizon Air,SBP,"San Luis Obispo, CA: San Luis County Regional",25.00,7.00,4.02,0.00,2.98,0.00,0.00,0.00,0.00,286.00,186.00,0.00,100.00,0.00,0.00
2019,1,QX,Horizon Air,SEA,"Seattle, WA: Seattle/Tacoma International",3483.00,659.00,89.11,23.53,375.95,0.00,170.41,91.00,2.00,26998.00,5406.00,1548.00,11522.00,0.00,8522.00
2019,1,QX,Horizon Air,SFO,"San Francisco, CA: San Francisco International",230.00,48.00,10.13,0.09,22.09,0.00,15.68,15.00,22.00,3094.00,580.00,20.00,1306.00,0.00,1188.00
2019,1,QX,Horizon Air,SJC,"San Jose, CA: Norman Y. Mineta San Jose International",36.00,4.00,0.00,0.00,0.88,0.25,2.87,0.00,0.00,165.00,0.00,0.00,44.00,7.00,114.00
2019,1,QX,Horizon Air,SMF,"Sacramento, CA: Sacramento International",163.00,15.00,5.60,0.00,2.98,0.00,6.42,1.00,0.00,458.00,186.00,0.00,89.00,0.00,183.00
2019,1,QX,Horizon Air,SNA,"Santa Ana, CA: John Wayne Airport-Orange County",186.00,43.00,7.69,0.19,17.55,0.00,17.58,17.00,0.00,2383.00,367.00,15.00,732.00,0.00,1269.00
2019,1,QX,Horizon Air,STS,"Santa Rosa, CA: Charles M. Schulz - Sonoma County",110.00,25.00,3.34,0.15,13.77,0.00,7.74,0.00,0.00,1682.00,166.00,14.00,468.00,0.00,1034.00
2019,1,QX,Horizon Air,SUN,"Sun Valley/Hailey/Ketchum, ID: Friedman Memorial",31.00,5.00,2.00,0.00,2.04,0.00,0.96,0.00,0.00,276.00,100.00,0.00,56.00,0.00,120.00
2019,1,QX,Horizon Air,YKM,"Yakima, WA: Yakima Air Terminal/McAllister Field",120.00,19.00,6.44,1.89,8.07,0.00,2.61,6.00,0.00,805.00,345.00,105.00,230.00,0.00,125.00
2019,1,UA,United Air Lines Network,ABQ,"Albuquerque, NM: Albuquerque International Sunport",57.00,9.00,1.12,1.09,2.83,0.00,3.97,3.00,0.00,662.00,161.00,67.00,73.00,0.00,361.00
2019,1,UA,United Air Lines Network,ALB,"Albany, NY: Albany International",35.00,13.00,1.44,2.90,5.52,0.00,3.15,2.00,0.00,1190.00,97.00,408.00,230.00,0.00,455.00
2019,1,UA,United Air Lines Network,ANC,"Anchorage, AK: Ted Stevens Anchorage International",43.00,9.00,4.15,0.00,3.81,0.00,1.04,0.00,2.00,379.00,199.00,0.00,134.00,0.00,46.00
2019,1,UA,United Air Lines Network,ATL,"Atlanta, GA: Hartsfield-Jackson Atlanta International",272.00,58.00,12.44,1.05,21.69,0.00,22.81,1.00,0.00,2762.00,645.00,38.00,607.00,0.00,1472.00
2019,1,UA,United Air Lines Network,AUS,"Austin, TX: Austin - Bergstrom International",514.00,68.00,14.66,5.34,20.08,0.00,27.92,2.00,0.00,4193.00,1158.00,382.00,930.00,0.00,1723.00
2019,1,UA,United Air Lines Network,BDL,"Hartford, CT: Bradley International",118.00,25.00,7.94,4.36,6.09,0.00,6.61,6.00,0.00,1785.00,312.00,293.00,147.00,0.00,1033.00
2019,1,UA,United Air Lines Network,BHM,"Birmingham, AL: Birmingham-Shuttlesworth International",4.00,2.00,1.14,0.00,0.00,0.00,0.86,0.00,0.00,100.00,50.00,0.00,0.00,0.00,50.00
2019,1,UA,United Air Lines Network,BIL,"Billings, MT: Billings Logan International",54.00,9.00,3.15,1.48,2.16,0.00,2.21,1.00,0.00,569.00,231.00,74.00,92.00,0.00,172.00
2019,1,UA,United Air Lines Network,BNA,"Nashville, TN: Nashville International",223.00,45.00,9.14,4.63,15.90,0.00,15.33,8.00,0.00,3036.00,584.00,478.00,658.00,0.00,1316.00
2019,1,UA,United Air Lines Network,BOI,"Boise, ID: Boise Air Terminal",61.00,10.00,3.96,0.00,2.65,0.00,3.39,0.00,0.00,399.00,202.00,0.00,80.00,0.00,117.00
2019,1,UA,United Air Lines Network,BOS,"Boston, MA: Logan International",951.00,225.00,48.57,10.02,103.57,0.00,62.85,36.00,1.00,22281.00,3622.00,977.00,10961.00,0.00,6721.00
2019,1,UA,United Air Lines Network,BQN,"Aguadilla, PR: Rafael Hernandez",31.00,9.00,2.81,0.00,2.59,0.00,3.60,0.00,0.00,331.00,65.00,0.00,105.00,0.00,161.00
2019,1,UA,United Air Lines Network,BTR,"Baton Rouge, LA: Baton Rouge Metropolitan/Ryan Field",1.00,0.00,0.00,0.00,0.00,0.00,0.00,0.00,0.00,0.00,0.00,0.00,0.00,0.00,0.00
2019,1,UA,United Air Lines Network,BTV,"Burlington, VT: Burlington International",62.00,21.00,0.66,2.74,7.54,0.00,10.06,6.00,1.00,1638.00,61.00,164.00,459.00,0.00,954.00
2019,1,UA,United Air Lines Network,BUF,"Buffalo, NY: Buffalo Niagara International",29.00,4.00,0.86,0.02,0.40,0.00,2.72,2.00,0.00,420.00,32.00,5.00,12.00,0.00,371.00
2019,1,UA,United Air Lines Network,BUR,"Burbank, CA: Bob Hope",31.00,4.00,0.00,0.00,1.56,0.00,2.44,2.00,0.00,277.00,0.00,0.00,63.00,0.00,214.00
2019,1,UA,United Air Lines Network,BWI,"Baltimore, MD: Baltimore/Washington International Thurgood Marshall",226.00,53.00,11.08,4.37,26.39,0.00,11.15,6.00,1.00,2711.00,735.00,428.00,862.00,0.00,686.00
2019,1,UA,United Air Lines Network,BZN,"Bozeman, MT: Bozeman Yellowstone International",159.00,25.00,4.80,2.04,5.20,0.00,12.97,6.00,0.00,1587.00,289.00,128.00,224.00,0.00,946.00
2019,1,UA,United Air Lines Network,CHS,"Charleston, SC: Charleston AFB/International",69.00,18.00,3.23,2.10,3.84,0.00,8.83,2.00,0.00,1632.00,277.00,130.00,195.00,0.00,1030.00
