2019,1,EV,ExpressJet Airlines Inc.,GRR,"Grand Rapids, MI: Gerald R. Ford International",64.00,18.00,6.67,0.00,9.68,0.00,1.65,5.00,0.00,1454.00,1072.00,0.00,339.00,0.00,43.00
2019,1,EV,ExpressJet Airlines Inc.,GSO,"Greensboro/High Point, NC: Piedmont Triad International",51.00,9.00,3.64,0.78,2.92,0.00,1.67,6.00,0.00,435.00,200.00,31.00,108.00,0.00,96.00
2019,1,EV,ExpressJet Airlines Inc.,GSP,"Greer, SC: Greenville-Spartanburg International",61.00,14.00,4.49,1.15,3.49,0.00,4.87,11.00,0.00,1382.00,548.00,114.00,145.00,0.00,575.00
2019,1,EV,ExpressJet Airlines Inc.,HOB,"Hobbs, NM: Lea County Regional",58.00,8.00,3.60,0.00,2.79,0.00,1.61,0.00,0.00,528.00,312.00,0.00,66.00,0.00,150.00
2019,1,EV,ExpressJet Airlines Inc.,HOU,"Houston, TX: William P Hobby",4.00,3.00,2.02,0.00,0.49,0.00,0.49,0.00,0.00,190.00,148.00,0.00,12.00,0.00,30.00
2019,1,EV,ExpressJet Airlines Inc.,HRL,"Harlingen/San Benito, TX: Valley International",73.00,8.00,1.06,0.00,4.30,0.00,2.64,0.00,1.00,355.00,110.00,0.00,131.00,0.00,114.00
2019,1,EV,ExpressJet Airlines Inc.,HSV,"Huntsville, AL: Huntsville International-Carl T Jones Field",96.00,20.00,9.84,0.25,2.38,0.00,7.54,3.00,0.00,2073.00,985.00,73.00,203.00,0.00,812.00
2019,1,EV,ExpressJet Airlines Inc.,IAD,"Washington, DC: Washington Dulles International",252.00,69.00,19.74,0.04,24.92,0.00,24.30,21.00,0.00,6673.00,1925.00,4.00,1432.00,0.00,3312.00
2019,1,EV,ExpressJet Airlines Inc.,IAH,"Houston, TX: George Bush Intercontinental/Houston",3379.00,482.00,83.88,12.01,209.21,0.00,176.90,49.00,4.00,35098.00,11633.00,1367.00,11077.00,0.00,11021.00
2019,1,EV,ExpressJet Airlines Inc.,ICT,"Wichita, KS: Wichita Dwight D Eisenhower National",86.00,13.00,2.47,0.22,3.80,0.00,6.50,6.00,0.00,1021.00,214.00,32.00,146.00,0.00,629.00
2019,1,EV,ExpressJet Airlines Inc.,ILM,"Wilmington, NC: Wilmington International",6.00,0.00,0.00,0.00,0.00,0.00,0.00,0.00,0.00,0.00,0.00,0.00,0.00,0.00,0.00
2019,1,EV,ExpressJet Airlines Inc.,IND,"Indianapolis, IN: Indianapolis International",164.00,26.00,7.77,0.00,12.93,0.00,5.30,10.00,0.00,1464.00,717.00,0.00,467.00,0.00,280.00
2019,1,EV,ExpressJet Airlines Inc.,JAN,"Jackson/Vicksburg, MS: Jackson Medgar Wiley Evers International",142.00,21.00,6.14,0.00,11.07,0.00,3.80,3.00,0.00,768.00,274.00,0.00,334.00,0.00,160.00
2019,1,EV,ExpressJet Airlines Inc.,JAX,"Jacksonville, FL: Jacksonville International",64.00,26.00,9.20,0.00,7.12,0.00,9.68,3.00,0.00,2460.00,977.00,0.00,517.00,0.00,966.00
2019,1,EV,ExpressJet Airlines Inc.,LBB,"Lubbock, TX: Lubbock Preston Smith International",79.00,13.00,4.30,0.00,4.76,0.00,3.94,0.00,0.00,952.00,388.00,0.00,259.00,0.00,305.00
2019,1,EV,ExpressJet Airlines Inc.,LCH,"Lake Charles, LA: Lake Charles Regional",89.00,17.00,6.37,0.00,5.32,0.00,5.31,1.00,0.00,1167.00,323.00,0.00,116.00,0.00,728.00
2019,1,EV,ExpressJet Airlines Inc.,LEX,"Lexington, KY: Blue Grass",65.00,15.00,4.14,0.00,6.24,0.00,4.62,9.00,0.00,1142.00,406.00,0.00,420.00,0.00,316.00
2019,1,EV,ExpressJet Airlines Inc.,LFT,"Lafayette, LA: Lafayette Regional Paul Fournet Field",114.00,14.00,4.03,0.91,6.06,0.00,3.00,1.00,2.00,827.00,192.00,148.00,170.00,0.00,317.00
2019,1,EV,ExpressJet Airlines Inc.,LGA,"New York, NY: LaGuardia",156.00,56.00,1.04,0.24,41.49,0.00,13.23,7.00,2.00,4405.00,103.00,7.00,2790.00,0.00,1505.00
2019,1,EV,ExpressJet Airlines Inc.,LIT,"Little Rock, AR: Bill and Hillary Clinton Nat Adams Field",116.00,22.00,7.26,0.07,4.53,0.00,10.14,4.00,0.00,1102.00,436.00,7.00,152.00,0.00,507.00
2019,1,EV,ExpressJet Airlines Inc.,LRD,"Laredo, TX: Laredo International",81.00,10.00,3.91,0.27,2.64,0.00,3.19,0.00,0.00,577.00,237.00,4.00,72.00,0.00,264.00
2019,1,EV,ExpressJet Airlines Inc.,MAF,"Midland/Odessa, TX: Midland International Air and Space Port",13.00,3.00,0.00,0.00,2.47,0.00,0.53,0.00,0.00,70.00,0.00,0.00,51.00,0.00,19.00
2019,1,EV,ExpressJet Airlines Inc.,MCI,"Kansas City, MO: Kansas City International",74.00,11.00,4.89,0.47,4.37,0.00,1.28,1.00,0.00,1358.00,911.00,43.00,222.00,0.00,182.00
2019,1,EV,ExpressJet Airlines Inc.,MDT,"Harrisburg, PA: Harrisburg International",3.00,3.00,0.67,0.15,0.85,0.00,1.33,0.00,0.00,129.00,40.00,6.00,33.00,0.00,50.00
2019,1,EV,ExpressJet Airlines Inc.,MEM,"Memphis, TN: Memphis International",169.00,34.00,13.95,2.96,9.30,0.00,7.79,10.00,0.00,3323.00,1442.00,1042.00,258.00,0.00,581.00
2019,1,EV,ExpressJet Airlines Inc.,MFE,"Mission/McAllen/Edinburg, TX: McAllen Miller International",57.00,9.00,2.76,0.00,4.07,0.00,2.17,1.00,1.00,467.00,233.00,0.00,148.00,0.00,86.00
2019,1,EV,ExpressJet Airlines Inc.,MHK,"Manhattan/Ft. Riley, KS: Manhattan Regional",5.00,2.00,0.00,0.00,1.00,0.00,1.00,0.00,0.00,67.00,0.00,0.00,20.00,0.00,47.00
2019,1,EV,ExpressJet Airlines Inc.,MHT,"Manchester, NH: Manchester-Boston Regional",1.00,0.00,0.00,0.00,0.00,0.00,0.00,0.00,0.00,0.00,0.00,0.00,0.00,0.00,0.00
2019,1,EV,ExpressJet Airlines Inc.,MKE,"Milwaukee, WI: General Mitchell International",101.00,44.00,16.35,2.33,16.31,0.00,9.00,9.00,0.00,4567.00,2252.00,321.00,883.00,0.00,1111.00
2019,1,EV,ExpressJet Airlines Inc.,MLI,"Moline, IL: Quad City International",28.00,15.00,7.42,0.69,3.82,0.00,3.07,3.00,0.00,1308.00,754.00,58.00,213.00,0.00,283.00
2019,1,EV,ExpressJet Airlines Inc.,MLU,"Monroe, LA: Monroe Regional",59.00,8.00,1.98,0.00,3.27,0.00,2.75,1.00,0.00,579.00,301.00,0.00,161.00,0.00,117.00
2019,1,EV,ExpressJet Airlines Inc.,MOB,"Mobile, AL: Mobile Regional",114.00,20.00,8.15,0.00,7.43,0.00,4.42,0.00,1.00,789.00,307.00,0.00,286.00,0.00,196.00
2019,1,EV,ExpressJet Airlines Inc.,MSN,"Madison, WI: Dane County Regional-Truax Field",13.00,4.00,0.00,0.00,2.00,0.00,2.00,0.00,0.00,166.00,0.00,0.00,75.00,0.00,91.00
2019,1,EV,ExpressJet Airlines Inc.,MSP,"Minneapolis, MN: Minneapolis-St Paul International",9.00,2.00,0.27,0.00,0.81,0.00,0.91,0.00,0.00,251.00,18.00,0.00,64.00,0.00,169.00
2019,1,EV,ExpressJet Airlines Inc.,MTJ,"Montrose/Delta, CO: Montrose Regional",7.00,2.00,0.00,0.00,2.00,0.00,0.00,0.00,0.00,45.00,0.00,0.00,45.00,0.00,0.00
2019,1,EV,ExpressJet Airlines Inc.,OKC,"Oklahoma City, OK: Will Rogers World",99.00,14.00,6.76,0.43,4.82,0.00,2.00,2.00,0.00,740.00,367.00,27.00,247.00,0.00,99.00
2019,1,EV,ExpressJet Airlines Inc.,OMA,"Omaha, NE: Eppley Airfield",52.00,9.00,1.03,0.40,5.16,0.00,2.41,2.00,0.00,410.00,58.00,6.00,161.00,0.00,185.00
2019,1,EV,ExpressJet Airlines Inc.,ORD,"Chicago, IL: Chicago O'Hare International",1310.00,368.00,51.74,7.53,179.98,0.00,128.76,250.00,5.00,38080.00,8169.00,3684.00,15207.00,0.00,11020.00
2019,1,EV,ExpressJet Airlines Inc.,ORF,"Norfolk, VA: Norfolk International",100.00,39.00,6.97,3.82,10.71,0.00,17.50,6.00,0.00,2948.00,619.00,319.00,484.00,0.00,1526.00
2019,1,EV,ExpressJet Airlines Inc.,PIA,"Peoria, IL: General Downing - Peoria International",1.00,0.00,0.00,0.00,0.00,0.00,0.00,0.00,0.00,0.00,0.00,0.00,0.00,0.00,0.00
2019,1,EV,ExpressJet Airlines Inc.,PIT,"Pittsburgh, PA: Pittsburgh International",10.00,3.00,2.00,0.00,0.00,0.00,1.00,1.00,0.00,180.00,151.00,0.00,0.00,0.00,29.00
2019,1,EV,ExpressJet Airlines Inc.,PNS,"Pensacola, FL: Pensacola International",95.00,19.00,6.02,1.43,7.87,0.00,3.67,4.00,0.00,1050.00,451.00,57.00,285.00,0.00,257.00
2019,1,EV,ExpressJet Airlines Inc.,PVD,"Providence, RI: Theodore Francis Green State",72.00,23.00,7.94,0.00,4.32,0.00,10.74,5.00,0.00,1897.00,791.00,0.00,336.00,0.00,770.00
2019,1,EV,ExpressJet Airlines Inc.,PWM,"Portland, ME: Portland International Jetport",39.00,16.00,3.21,0.42,6.30,0.00,6.06,1.00,0.00,709.00,283.00,25.00,179.00,0.00,222.00
2019,1,EV,ExpressJet Airlines Inc.,RDU,"Raleigh/Durham, NC: Raleigh-Durham International",6.00,0.00,0.00,0.00,0.00,0.00,0.00,1.00,0.00,0.00,0.00,0.00,0.00,0.00,0.00
2019,1,EV,ExpressJet Airlines Inc.,RIC,"Richmond, VA: Richmond International",182.00,69.00,23.06,3.88,12.40,0.00,29.65,23.00,0.00,6311.00,2623.00,246.00,656.00,0.00,2786.00
2019,1,EV,ExpressJet Airlines Inc.,ROC,"Rochester, NY: Greater Rochester International",83.00,25.00,7.44,1.49,8.68,0.00,7.39,10.00,1.00,1448.00,625.00,88.00,261.00,0.00,474.00
2019,1,EV,ExpressJet Airlines Inc.,RST,"Rochester, MN: Rochester International",57.00,22.00,5.07,0.83,7.11,0.00,8.98,11.00,0.00,1320.00,245.00,86.00,304.00,0.00,685.00
2019,1,EV,ExpressJet Airlines Inc.,SAF,"Santa Fe, NM: Santa Fe Municipal",3.00,,0.00,0.00,0.00,0.00,0.00,3.00,0.00,0.00,0.00,0.00,0.00,0.00,0.00
2019,1,EV,ExpressJet Airlines Inc.,SAV,"Savannah, GA: Savannah/Hilton Head International",113.00,27.00,7.70,1.23,12.06,0.00,6.01,11.00,0.00,1626.00,514.00,47.00,631.00,0.00,434.00
2019,1,EV,ExpressJet Airlines Inc.,SBN,"South Bend, IN: South Bend International",44.00,16.00,5.06,0.00,2.30,0.00,8.64,5.00,0.00,1099.00,440.00,0.00,94.00,0.00,565.00
2019,1,EV,ExpressJet Airlines Inc.,SCE,"State College, PA: University Park",1.00,0.00,0.00,0.00,0.00,0.00,0.00,0.00,0.00,0.00,0.00,0.00,0.00,0.00,0.00
2019,1,EV,ExpressJet Airlines Inc.,SDF,"Louisville, KY: Louisville Muhammad Ali International",16.00,5.00,0.58,0.00,1.97,0.00,2.46,0.00,0.00,468.00,76.00,0.00,142.00,0.00,250.00
2019,1,EV,ExpressJet Airlines Inc.,SGF,"Springfield, MO: Springfield-Branson National",43.00,7.00,1.46,0.00,4.35,0.00,1.19,0.00,0.00,859.00,665.00,0.00,160.00,0.00,34.00
2019,1,EV,ExpressJet Airlines Inc.,SHV,"Shreveport, LA: Shreveport Regional",85.00,11.00,1.93,0.00,2.21,0.00,6.85,1.00,0.00,1340.00,840.00,0.00,71.00,0.00,429.00
2019,1,EV,ExpressJet Airlines Inc.,STL,"St. Louis, MO: St Louis Lambert International",183.00,52.00,16.57,0.00,22.39,0.00,13.04,8.00,0.00,4522.00,2179.00,0.00,1068.00,0.00,1275.00
2019,1,EV,ExpressJet Airlines Inc.,SYR,"Syracuse, NY: Syracuse Hancock International",36.00,15.00,4.21,0.00,1.84,0.00,8.95,3.00,1.00,1632.00,442.00,0.00,111.00,0.00,1079.00
2019,1,EV,ExpressJet Airlines Inc.,TUL,"Tulsa, OK: Tulsa International",189.00,34.00,7.80,2.42,9.57,0.00,14.21,10.00,0.00,2673.00,646.00,233.00,606.00,0.00,1188.00
2019,1,EV,ExpressJet Airlines Inc.,TYS,"Knoxville, TN: McGhee Tyson",240.00,72.00,22.87,2.98,24.15,0.00,22.00,15.00,0.00,6224.00,2439.00,429.00,1247.00,0.00,2109.00
2019,1,EV,ExpressJet Airlines Inc.,VPS,"Valparaiso, FL: Eglin AFB Destin Fort Walton Beach",62.00,9.00,3.09,0.00,3.80,0.00,2.11,3.00,1.00,331.00,125.00,0.00,115.00,0.00,91.00
2019,1,EV,ExpressJet Airlines Inc.,XNA,"Fayetteville, AR: Northwest Arkansas Regional",38.00,4.00,1.68,0.00,1.13,0.00,1.19,1.00,0.00,206.00,53.00,0.00,72.00,0.00,81.00
2019,1,F9,Frontier Airlines,ABQ,"Albuquerque, NM: Albuquerque International Sunport",14.00,8.00,0.38,0.00,5.70,0.00,1.91,0.00,0.00,378.00,15.00,0.00,222.00,0.00,141.00
2019,1,F9,Frontier Airlines,ALB,"Albany, NY: Albany International",21.00,5.00,0.67,1.00,2.41,0.00,0.93,0.00,0.00,332.00,53.00,91.00,75.00,0.00,113.00
2019,1,F9,Frontier Airlines,ATL,"Atlanta, GA: Hartsfield-Jackson Atlanta International",247.00,59.00,14.95,0.00,19.19,0.00,24.86,1.00,0.00,3691.00,751.00,0.00,857.00,0.00,2083.00
2019,1,F9,Frontier Airlines,AUS,"Austin, TX: Austin - Bergstrom International",159.00,42.00,14.20,0.00,11.93,0.00,15.87,0.00,0.00,3197.00,1164.00,0.00,511.00,0.00,1522.00
2019,1,F9,Frontier Airlines,BHM,"Birmingham, AL: Birmingham-Shuttlesworth International",13.00,4.00,0.52,0.00,0.94,0.00,2.54,0.00,0.00,191.00,32.00,0.00,15.00,0.00,144.00
2019,1,F9,Frontier Airlines,BMI,"Bloomington/Normal, IL: Central Il Regional Airport at Bloomington",14.00,1.00,1.00,0.00,0.00,0.00,0.00,0.00,0.00,15.00,15.00,0.00,0.00,0.00,0.00
2019,1,F9,Frontier Airlines,BNA,"Nashville, TN: Nashville International",102.00,25.00,12.72,0.00,5.41,0.00,6.87,0.00,0.00,1508.00,870.00,0.00,216.00,0.00,422.00
2019,1,F9,Frontier Airlines,BUF,"Buffalo, NY: Buffalo Niagara International",66.00,15.00,4.23,0.00,6.51,0.00,4.26,5.00,0.00,972.00,489.00,0.00,189.00,0.00,294.00
2019,1,F9,Frontier Airlines,BZN,"Bozeman, MT: Bozeman Yellowstone International",18.00,4.00,0.91,0.00,0.06,0.00,3.04,0.00,0.00,203.00,39.00,0.00,2.00,0.00,162.00
2019,1,F9,Frontier Airlines,CHS,"Charleston, SC: Charleston AFB/International",11.00,0.00,0.00,0.00,0.00,0.00,0.00,0.00,0.00,0.00,0.00,0.00,0.00,0.00,0.00
2019,1,F9,Frontier Airlines,CID,"Cedar Rapids/Iowa City, IA: The Eastern Iowa",14.00,2.00,1.00,0.00,0.00,0.00,1.00,0.00,0.00,119.00,15.00,0.00,0.00,0.00,104.00
2019,1,F9,Frontier Airlines,CLE,"Cleveland, OH: Cleveland-Hopkins International",208.00,47.00,15.43,0.00,14.82,0.00,16.75,1.00,1.00,3201.00,922.00,0.00,664.00,0.00,1615.00
2019,1,F9,Frontier Airlines,CLT,"Charlotte, NC: Charlotte Douglas International",100.00,27.00,8.33,0.43,7.67,0.00,10.57,0.00,0.00,1489.00,446.00,27.00,230.00,0.00,786.00
2019,1,F9,Frontier Airlines,CMH,"Columbus, OH: John Glenn Columbus International",25.00,6.00,2.76,0.00,1.48,0.00,1.77,0.00,0.00,448.00,164.00,0.00,43.00,0.00,241.00
2019,1,F9,Frontier Airlines,COS,"Colorado Springs, CO: City of Colorado Springs Municipal",71.00,7.00,1.79,0.00,1.58,0.00,3.64,0.00,0.00,334.00,43.00,0.00,43.00,0.00,248.00
2019,1,F9,Frontier Airlines,CVG,"Cincinnati, OH: Cincinnati/Northern Kentucky International",158.00,39.00,12.47,0.73,9.65,0.00,16.16,1.00,0.00,2496.00,900.00,24.00,430.00,0.00,1142.00
2019,1,F9,Frontier Airlines,DCA,"Washington, DC: Ronald Reagan Washington National",88.00,21.00,6.22,0.03,6.85,0.00,7.90,1.00,0.00,1338.00,287.00,1.00,441.00,0.00,609.00
2019,1,F9,Frontier Airlines,DEN,"Denver, CO: Denver International",1676.00,363.00,98.69,12.22,98.03,0.00,154.06,16.00,1.00,24436.00,8656.00,1027.00,4251.00,0.00,10502.00
2019,1,F9,Frontier Airlines,DFW,"Dallas/Fort Worth, TX: Dallas/Fort Worth International",31.00,5.00,1.90,0.00,1.10,0.00,2.00,0.00,0.00,209.00,56.00,0.00,20.00,0.00,133.00
2019,1,F9,Frontier Airlines,DSM,"Des Moines, IA: Des Moines International",40.00,10.00,2.69,0.00,1.80,0.00,5.51,1.00,0.00,630.00,77.00,0.00,101.00,0.00,452.00
2019,1,F9,Frontier Airlines,DTW,"Detroit, MI: Detroit Metro Wayne County",44.00,9.00,4.48,0.00,2.12,0.00,2.40,0.00,0.00,698.00,310.00,0.00,197.00,0.00,191.00
2019,1,F9,Frontier Airlines,ELP,"El Paso, TX: El Paso International",9.00,2.00,0.16,0.00,1.00,0.00,0.84,0.00,0.00,73.00,8.00,0.00,22.00,0.00,43.00
2019,1,F9,Frontier Airlines,FAR,"Fargo, ND: Hector International",13.00,4.00,1.36,0.00,2.64,0.00,0.00,1.00,0.00,158.00,65.00,0.00,93.00,0.00,0.00
2019,1,F9,Frontier Airlines,FAT,"Fresno, CA: Fresno Yosemite International",14.00,3.00,0.85,0.00,0.71,0.00,1.44,0.00,0.00,139.00,42.00,0.00,30.00,0.00,67.00
2019,1,F9,Frontier Airlines,FLL,"Fort Lauderdale, FL: Fort Lauderdale-Hollywood International",34.00,11.00,2.89,0.00,2.99,0.00,5.13,0.00,0.00,684.00,219.00,0.00,153.00,0.00,312.00
2019,1,F9,Frontier Airlines,FSD,"Sioux Falls, SD: Joe Foss Field",10.00,2.00,0.00,0.00,2.00,0.00,0.00,0.00,0.00,56.00,0.00,0.00,56.00,0.00,0.00
2019,1,F9,Frontier Airlines,GEG,"Spokane, WA: Spokane International",9.00,7.00,1.16,0.00,5.11,0.00,0.74,0.00,0.00,260.00,31.00,0.00,162.00,0.00,67.00
2019,1,F9,Frontier Airlines,GRR,"Grand Rapids, MI: Gerald R. Ford International",78.00,24.00,11.46,0.41,11.28,0.00,0.84,5.00,0.00,1778.00,1109.00,73.00,548.00,0.00,48.00
2019,1,F9,Frontier Airlines,GSP,"Greer, SC: Greenville-Spartanburg International",20.00,3.00,1.00,0.00,1.00,0.00,1.00,1.00,0.00,51.00,16.00,0.00,19.00,0.00,16.00
2019,1,F9,Frontier Airlines,HRL,"Harlingen/San Benito, TX: Valley International",18.00,5.00,0.59,0.62,2.49,0.00,1.30,1.00,0.00,475.00,88.00,91.00,110.00,0.00,186.00
2019,1,F9,Frontier Airlines,HSV,"Huntsville, AL: Huntsville International-Carl T Jones Field",20.00,5.00,1.63,0.00,0.00,0.00,3.37,0.00,0.00,370.00,123.00,0.00,0.00,0.00,247.00
2019,1,F9,Frontier Airlines,IAD,"Washington, DC: Washington Dulles International",64.00,9.00,4.58,0.00,2.59,0.00,1.82,0.00,0.00,433.00,256.00,0.00,51.00,0.00,126.00
2019,1,F9,Frontier Airlines,IAH,"Houston, TX: George Bush Intercontinental/Houston",32.00,7.00,1.79,0.00,1.55,0.00,3.66,0.00,0.00,324.00,59.00,0.00,55.00,0.00,210.00
2019,1,F9,Frontier Airlines,ICT,"Wichita, KS: Wichita Dwight D Eisenhower National",9.00,1.00,0.00,0.00,0.00,0.00,1.00,0.00,0.00,44.00,0.00,0.00,0.00,0.00,44.00
2019,1,F9,Frontier Airlines,IND,"Indianapolis, IN: Indianapolis International",66.00,9.00,1.67,0.52,1.48,0.00,5.33,1.00,0.00,543.00,80.00,17.00,67.00,0.00,379.00
2019,1,F9,Frontier Airlines,ISP,"Islip, NY: Long Island MacArthur",124.00,60.00,15.44,0.00,17.43,0.00,27.13,1.00,0.00,4002.00,988.00,0.00,914.00,0.00,2100.00
2019,1,F9,Frontier Airlines,JAN,"Jackson/Vicksburg, MS: Jackson Medgar Wiley Evers International",17.00,3.00,0.73,0.00,1.27,0.00,1.00,0.00,0.00,103.00,37.00,0.00,30.00,0.00,36.00
2019,1,F9,Frontier Airlines,JAX,"Jacksonville, FL: Jacksonville International",86.00,18.00,1.96,1.74,9.18,0.00,5.11,2.00,0.00,869.00,50.00,135.00,361.00,0.00,323.00
2019,1,F9,Frontier Airlines,LAS,"Las Vegas, NV: McCarran International",582.00,163.00,30.77,4.25,66.43,0.00,61.55,6.00,0.00,11347.00,1986.00,371.00,3189.00,0.00,5801.00
2019,1,F9,Frontier Airlines,LAX,"Los Angeles, CA: Los Angeles International",59.00,15.00,5.77,0.00,5.61,0.00,3.62,0.00,0.00,893.00,408.00,0.00,177.00,0.00,308.00
2019,1,F9,Frontier Airlines,LFT,"Lafayette, LA: Lafayette Regional Paul Fournet Field",16.00,4.00,0.00,0.00,2.00,0.00,2.00,0.00,0.00,227.00,0.00,0.00,42.00,0.00,185.00
2019,1,F9,Frontier Airlines,LGA,"New York, NY: LaGuardia",93.00,37.00,8.47,0.21,22.15,0.00,6.16,2.00,0.00,2807.00,350.00,46.00,1722.00,0.00,689.00
2019,1,F9,Frontier Airlines,LIT,"Little Rock, AR: Bill and Hillary Clinton Nat Adams Field",13.00,3.00,2.14,0.00,0.22,0.00,0.64,0.00,0.00,211.00,147.00,0.00,17.00,0.00,47.00
2019,1,F9,Frontier Airlines,MCI,"Kansas City, MO: Kansas City International",18.00,1.00,0.00,0.00,0.02,0.00,0.98,0.00,0.00,103.00,0.00,0.00,2.00,0.00,101.00
2019,1,F9,Frontier Airlines,MCO,"Orlando, FL: Orlando International",1144.00,271.00,58.41,6.29,113.50,0.00,92.79,20.00,0.00,15953.00,3507.00,472.00,4327.00,0.00,7647.00
2019,1,F9,Frontier Airlines,MDT,"Harrisburg, PA: Harrisburg International",14.00,3.00,2.85,0.00,0.15,0.00,0.00,0.00,0.00,282.00,272.00,0.00,10.00,0.00,0.00
2019,1,F9,Frontier Airlines,MEM,"Memphis, TN: Memphis International",28.00,7.00,1.51,0.00,1.35,0.00,4.14,0.00,0.00,201.00,42.00,0.00,24.00,0.00,135.00
2019,1,F9,Frontier Airlines,MIA,"Miami, FL: Miami International",139.00,42.00,8.08,0.43,12.92,0.00,20.57,5.00,0.00,2878.00,432.00,31.00,593.00,0.00,1822.00
2019,1,F9,Frontier Airlines,MKE,"Milwaukee, WI: General Mitchell International",127.00,36.00,10.54,0.69,15.43,0.00,9.34,5.00,0.00,1897.00,794.00,60.00,595.00,0.00,448.00
2019,1,F9,Frontier Airlines,MSN,"Madison, WI: Dane County Regional-Truax Field",59.00,10.00,2.97,0.00,3.96,0.00,3.07,1.00,0.00,377.00,112.00,0.00,160.00,0.00,105.00
2019,1,F9,Frontier Airlines,MSP,"Minneapolis, MN: Minneapolis-St Paul International",106.00,25.00,8.56,0.63,10.77,0.00,5.05,4.00,0.00,1393.00,622.00,25.00,425.00,0.00,321.00
2019,1,F9,Frontier Airlines,MSY,"New Orleans, LA: Louis Armstrong New Orleans International",78.00,16.00,4.36,1.51,7.95,0.00,2.18,0.00,0.00,775.00,255.00,50.00,266.00,0.00,204.00
2019,1,F9,Frontier Airlines,OKC,"Oklahoma City, OK: Will Rogers World",20.00,2.00,0.18,0.00,0.28,0.00,1.55,0.00,0.00,64.00,7.00,0.00,11.00,0.00,46.00
2019,1,F9,Frontier Airlines,OMA,"Omaha, NE: Eppley Airfield",45.00,7.00,3.70,0.00,1.76,0.00,1.54,0.00,0.00,517.00,222.00,0.00,141.00,0.00,154.00
2019,1,F9,Frontier Airlines,ONT,"Ontario, CA: Ontario International",48.00,21.00,2.90,0.00,13.70,0.00,4.41,0.00,0.00,843.00,98.00,0.00,408.00,0.00,337.00
2019,1,F9,Frontier Airlines,ORD,"Chicago, IL: Chicago O'Hare International",262.00,65.00,15.68,0.00,26.47,0.00,22.84,29.00,0.00,5137.00,1065.00,0.00,1463.00,0.00,2609.00
2019,1,F9,Frontier Airlines,ORF,"Norfolk, VA: Norfolk International",52.00,13.00,5.39,0.00,4.48,0.00,3.13,0.00,0.00,883.00,335.00,0.00,159.00,0.00,389.00
2019,1,F9,Frontier Airlines,PBI,"West Palm Beach/Palm Beach, FL: Palm Beach International",130.00,32.00,12.62,1.22,14.97,0.00,3.19,2.00,0.00,2055.00,1250.00,44.00,632.00,0.00,129.00
2019,1,F9,Frontier Airlines,PDX,"Portland, OR: Portland International",40.00,8.00,6.01,0.00,1.99,0.00,0.00,0.00,0.00,305.00,223.00,0.00,82.00,0.00,0.00
2019,1,F9,Frontier Airlines,PHL,"Philadelphia, PA: Philadelphia International",354.00,94.00,28.62,0.00,33.46,0.00,31.93,0.00,0.00,5265.00,1321.00,0.00,1228.00,0.00,2716.00
2019,1,F9,Frontier Airlines,PHX,"Phoenix, AZ: Phoenix Sky Harbor International",254.00,55.00,16.81,0.37,20.94,0.00,16.88,5.00,1.00,2977.00,812.00,35.00,740.00,0.00,1390.00
2019,1,F9,Frontier Airlines,PIT,"Pittsburgh, PA: Pittsburgh International",20.00,7.00,2.48,1.00,1.64,0.00,1.88,0.00,0.00,262.00,59.00,32.00,36.00,0.00,135.00
2019,1,F9,Frontier Airlines,PNS,"Pensacola, FL: Pensacola International",21.00,2.00,0.02,0.32,0.99,0.00,0.67,2.00,0.00,161.00,2.00,9.00,61.00,0.00,89.00
2019,1,F9,Frontier Airlines,PSM,"Portsmouth, NH: Portsmouth International at Pease",14.00,1.00,0.70,0.00,0.30,0.00,0.00,1.00,0.00,44.00,31.00,0.00,13.00,0.00,0.00
2019,1,F9,Frontier Airlines,PSP,"Palm Springs, CA: Palm Springs International",25.00,9.00,2.94,0.24,3.10,0.00,2.72,0.00,0.00,498.00,118.00,17.00,125.00,0.00,238.00
2019,1,F9,Frontier Airlines,PVD,"Providence, RI: Theodore Francis Green State",48.00,9.00,2.71,0.00,4.16,0.00,2.13,0.00,1.00,535.00,132.00,0.00,126.00,0.00,277.00
2019,1,F9,Frontier Airlines,PWM,"Portland, ME: Portland International Jetport",39.00,2.00,1.00,0.00,0.00,0.00,1.00,2.00,0.00,408.00,307.00,0.00,0.00,0.00,101.00
2019,1,F9,Frontier Airlines,RDU,"Raleigh/Durham, NC: Raleigh-Durham International",167.00,34.00,8.15,0.92,9.31,0.00,15.62,0.00,0.00,2116.00,388.00,22.00,291.00,0.00,1415.00
2019,1,F9,Frontier Airlines,RNO,"Reno, NV: Reno/Tahoe International",9.00,0.00,0.00,0.00,0.00,0.00,0.00,0.00,0.00,0.00,0.00,0.00,0.00,0.00,0.00
2019,1,F9,Frontier Airlines,RSW,"Fort Myers, FL: Southwest Florida International",392.00,106.00,26.88,2.44,42.96,0.00,33.73,9.00,1.00,7914.00,2247.00,400.00,2092.00,0.00,3175.00
2019,1,F9,Frontier Airlines,SAN,"San Diego, CA: San Diego International",121.00,48.00,12.62,0.06,26.78,0.00,8.54,1.00,0.00,2658.00,1004.00,7.00,961.00,0.00,686.00
2019,1,F9,Frontier Airlines,SAT,"San Antonio, TX: San Antonio International",90.00,16.00,7.52,0.06,3.31,0.00,5.12,0.00,0.00,1002.00,420.00,1.00,82.00,0.00,499.00
2019,1,F9,Frontier Airlines,SAV,"Savannah, GA: Savannah/Hilton Head International",8.00,2.00,0.60,0.00,0.59,0.00,0.81,0.00,0.00,85.00,25.00,0.00,25.00,0.00,35.00
2019,1,F9,Frontier Airlines,SBA,"Santa Barbara, CA: Santa Barbara Municipal",14.00,4.00,2.37,0.00,0.77,0.00,0.86,0.00,0.00,115.00,68.00,0.00,23.00,0.00,24.00
2019,1,F9,Frontier Airlines,SDF,"Louisville, KY: Louisville Muhammad Ali International",18.00,7.00,2.32,0.00,4.04,0.00,0.65,0.00,0.00,143.00,56.00,0.00,76.00,0.00,11.00
2019,1,F9,Frontier Airlines,SEA,"Seattle, WA: Seattle/Tacoma International",40.00,5.00,0.21,0.00,1.00,0.00,3.79,0.00,0.00,365.00,19.00,0.00,30.00,0.00,316.00
2019,1,F9,Frontier Airlines,SFO,"San Francisco, CA: San Francisco International",71.00,26.00,6.93,0.00,16.57,0.00,2.50,0.00,0.00,2215.00,545.00,0.00,1520.00,0.00,150.00
2019,1,F9,Frontier Airlines,SJC,"San Jose, CA: Norman Y. Mineta San Jose International",20.00,9.00,3.35,0.00,3.00,0.00,2.65,0.00,0.00,772.00,420.00,0.00,126.00,0.00,226.00
2019,1,F9,Frontier Airlines,SJU,"San Juan, PR: Luis Munoz Marin International",96.00,20.00,6.88,0.00,8.28,0.00,4.84,0.00,0.00,972.00,381.00,0.00,327.00,0.00,264.00
2019,1,F9,Frontier Airlines,SLC,"Salt Lake City, UT: Salt Lake City International",119.00,25.00,9.41,0.00,7.38,0.00,8.21,0.00,0.00,1210.00,439.00,0.00,330.00,0.00,441.00
2019,1,F9,Frontier Airlines,SMF,"Sacramento, CA: Sacramento International",19.00,9.00,3.47,0.00,3.53,0.00,2.00,0.00,0.00,658.00,134.00,0.00,226.00,0.00,298.00
2019,1,F9,Frontier Airlines,SNA,"Santa Ana, CA: John Wayne Airport-Orange County",62.00,14.00,2.48,0.00,3.73,0.00,7.79,0.00,0.00,866.00,128.00,0.00,110.00,0.00,628.00
2019,1,F9,Frontier Airlines,SRQ,"Sarasota/Bradenton, FL: Sarasota/Bradenton International",29.00,4.00,1.72,0.00,1.31,0.00,0.96,0.00,0.00,469.00,333.00,0.00,59.00,0.00,77.00
2019,1,F9,Frontier Airlines,STL,"St. Louis, MO: St Louis Lambert International",109.00,31.00,9.23,0.51,11.75,0.00,9.51,5.00,1.00,1377.00,323.00,23.00,489.00,0.00,542.00
2019,1,F9,Frontier Airlines,SYR,"Syracuse, NY: Syracuse Hancock International",45.00,12.00,2.97,0.00,5.44,0.00,3.59,3.00,0.00,727.00,138.00,0.00,185.00,0.00,404.00
2019,1,F9,Frontier Airlines,TPA,"Tampa, FL: Tampa International",375.00,96.00,28.59,3.04,46.09,0.00,18.28,9.00,0.00,5308.00,1812.00,252.00,1905.00,0.00,1339.00
2019,1,F9,Frontier Airlines,TTN,"Trenton, NJ: Trenton Mercer",204.00,53.00,17.34,0.00,17.10,0.00,18.57,2.00,0.00,3515.00,743.00,0.00,605.00,0.00,2167.00
2019,1,F9,Frontier Airlines,TUL,"Tulsa, OK: Tulsa International",14.00,2.00,1.43,0.00,0.57,0.00,0.00,0.00,0.00,49.00,32.00,0.00,17.00,0.00,0.00
2019,1,F9,Frontier Airlines,TUS,"Tucson, AZ: Tucson International",17.00,4.00,2.04,0.52,1.44,0.00,0.00,0.00,0.00,193.00,126.00,25.00,42.00,0.00,0.00
2019,1,F9,Frontier Airlines,TYS,"Knoxville, TN: McGhee Tyson",17.00,3.00,0.02,0.53,1.47,0.00,0.98,0.00,0.00,97.00,1.00,8.00,44.00,0.00,44.00
2019,1,G4,Allegiant Air,ABE,"Allentown/Bethlehem/Easton, PA: Lehigh Valley International",55.00,5.00,1.00,0.00,1.25,0.00,2.75,0.00,0.00,154.00,29.00,0.00,37.00,0.00,88.00
2019,1,G4,Allegiant Air,ABQ,"Albuquerque, NM: Albuquerque International Sunport",18.00,0.00,0.00,0.00,0.00,0.00,0.00,0.00,0.00,0.00,0.00,0.00,0.00,0.00,0.00
2019,1,G4,Allegiant Air,ALB,"Albany, NY: Albany International",39.00,3.00,2.65,0.00,0.00,0.00,0.35,2.00,0.00,211.00,196.00,0.00,0.00,0.00,15.00
2019,1,G4,Allegiant Air,ATW,"Appleton, WI: Appleton International",45.00,8.00,3.30,1.00,2.75,0.00,0.95,0.00,0.00,282.00,143.00,55.00,65.00,0.00,19.00
2019,1,G4,Allegiant Air,AUS,"Austin, TX: Austin - Bergstrom International",33.00,9.00,1.47,0.67,6.05,0.00,0.81,0.00,0.00,348.00,29.00,47.00,255.00,0.00,17.00
