2019,1,MQ,Envoy Air,MSO,"Missoula, MT: Missoula International",31.00,3.00,1.14,0.53,1.27,0.00,0.06,0.00,0.00,136.00,46.00,37.00,49.00,0.00,4.00
2019,1,MQ,Envoy Air,MSY,"New Orleans, LA: Louis Armstrong New Orleans International",4.00,0.00,0.00,0.00,0.00,0.00,0.00,0.00,0.00,0.00,0.00,0.00,0.00,0.00,0.00
2019,1,MQ,Envoy Air,MTJ,"Montrose/Delta, CO: Montrose Regional",5.00,0.00,0.00,0.00,0.00,0.00,0.00,0.00,0.00,0.00,0.00,0.00,0.00,0.00,0.00
2019,1,MQ,Envoy Air,OKC,"Oklahoma City, OK: Will Rogers World",7.00,2.00,0.64,0.00,0.11,0.00,1.25,0.00,0.00,50.00,18.00,0.00,3.00,0.00,29.00
2019,1,MQ,Envoy Air,OMA,"Omaha, NE: Eppley Airfield",114.00,25.00,4.72,2.16,13.77,0.00,4.35,17.00,0.00,1107.00,278.00,144.00,508.00,0.00,177.00
2019,1,MQ,Envoy Air,ORD,"Chicago, IL: Chicago O'Hare International",5480.00,1278.00,195.38,61.88,444.62,0.71,575.42,815.00,7.00,87853.00,18265.00,6310.00,27798.00,25.00,35455.00
2019,1,MQ,Envoy Air,ORF,"Norfolk, VA: Norfolk International",144.00,49.00,2.08,0.23,14.13,0.00,32.57,7.00,0.00,3435.00,173.00,8.00,466.00,0.00,2788.00
2019,1,MQ,Envoy Air,PBI,"West Palm Beach/Palm Beach, FL: Palm Beach International",27.00,7.00,1.34,0.00,3.06,0.78,1.82,1.00,0.00,379.00,94.00,0.00,144.00,21.00,120.00
2019,1,MQ,Envoy Air,PIA,"Peoria, IL: General Downing - Peoria International",62.00,15.00,3.70,1.57,5.60,0.00,4.13,12.00,0.00,1306.00,202.00,677.00,231.00,0.00,196.00
2019,1,MQ,Envoy Air,PIT,"Pittsburgh, PA: Pittsburgh International",261.00,82.00,11.59,3.76,26.62,0.00,40.03,12.00,0.00,4068.00,494.00,119.00,907.00,0.00,2548.00
2019,1,MQ,Envoy Air,PNS,"Pensacola, FL: Pensacola International",125.00,21.00,4.67,0.57,9.17,0.00,6.60,0.00,0.00,819.00,216.00,13.00,237.00,0.00,353.00
2019,1,MQ,Envoy Air,PVD,"Providence, RI: Theodore Francis Green State",49.00,17.00,1.00,1.83,11.47,0.00,2.70,7.00,0.00,712.00,86.00,61.00,433.00,0.00,132.00
2019,1,MQ,Envoy Air,PWM,"Portland, ME: Portland International Jetport",50.00,18.00,6.38,0.38,3.24,0.00,8.00,2.00,0.00,902.00,332.00,31.00,69.00,0.00,470.00
2019,1,MQ,Envoy Air,RDU,"Raleigh/Durham, NC: Raleigh-Durham International",252.00,78.00,14.11,0.00,26.25,0.13,37.50,6.00,0.00,4495.00,755.00,0.00,990.00,10.00,2740.00
2019,1,MQ,Envoy Air,RIC,"Richmond, VA: Richmond International",195.00,68.00,12.12,1.87,17.97,0.00,36.04,22.00,0.00,4138.00,603.00,196.00,780.00,0.00,2559.00
2019,1,MQ,Envoy Air,ROA,"Roanoke, VA: Roanoke Blacksburg Regional Woodrum Field",52.00,14.00,2.74,0.69,2.46,0.00,8.11,2.00,1.00,726.00,323.00,31.00,112.00,0.00,260.00
2019,1,MQ,Envoy Air,ROC,"Rochester, NY: Greater Rochester International",106.00,26.00,4.67,2.26,11.81,0.00,7.26,17.00,0.00,1259.00,313.00,99.00,484.00,0.00,363.00
2019,1,MQ,Envoy Air,RST,"Rochester, MN: Rochester International",116.00,35.00,6.83,6.92,11.50,0.00,9.75,22.00,0.00,2307.00,474.00,633.00,523.00,0.00,677.00
2019,1,MQ,Envoy Air,SAT,"San Antonio, TX: San Antonio International",26.00,4.00,1.16,0.64,1.92,0.00,0.29,5.00,0.00,120.00,50.00,14.00,41.00,0.00,15.00
2019,1,MQ,Envoy Air,SAV,"Savannah, GA: Savannah/Hilton Head International",65.00,15.00,3.41,0.71,4.33,0.00,6.56,1.00,1.00,601.00,180.00,29.00,129.00,0.00,263.00
2019,1,MQ,Envoy Air,SDF,"Louisville, KY: Louisville Muhammad Ali International",61.00,18.00,2.70,1.01,8.93,0.00,5.37,1.00,0.00,890.00,180.00,36.00,383.00,0.00,291.00
2019,1,MQ,Envoy Air,SGF,"Springfield, MO: Springfield-Branson National",428.00,80.00,13.31,5.18,27.42,0.00,34.09,15.00,0.00,3954.00,705.00,213.00,982.00,0.00,2054.00
2019,1,MQ,Envoy Air,SHV,"Shreveport, LA: Shreveport Regional",174.00,28.00,5.97,1.17,11.15,0.00,9.72,0.00,0.00,1655.00,360.00,55.00,268.00,0.00,972.00
2019,1,MQ,Envoy Air,SJT,"San Angelo, TX: San Angelo Regional/Mathis Field",135.00,23.00,10.78,0.35,6.54,0.00,5.33,2.00,0.00,835.00,320.00,27.00,192.00,0.00,296.00
2019,1,MQ,Envoy Air,SPI,"Springfield, IL: Abraham Lincoln Capital",53.00,5.00,2.91,0.00,1.09,0.00,1.00,2.00,0.00,169.00,100.00,0.00,28.00,0.00,41.00
2019,1,MQ,Envoy Air,SPS,"Wichita Falls, TX: Sheppard AFB/Wichita Falls Municipal",88.00,8.00,2.36,0.22,2.45,0.00,2.97,6.00,0.00,263.00,98.00,5.00,66.00,0.00,94.00
2019,1,MQ,Envoy Air,SRQ,"Sarasota/Bradenton, FL: Sarasota/Bradenton International",31.00,13.00,1.25,0.55,9.90,0.00,1.30,2.00,0.00,537.00,41.00,60.00,391.00,0.00,45.00
2019,1,MQ,Envoy Air,STL,"St. Louis, MO: St Louis Lambert International",59.00,15.00,3.61,2.07,5.05,0.00,4.28,7.00,0.00,683.00,205.00,78.00,218.00,0.00,182.00
2019,1,MQ,Envoy Air,SUX,"Sioux City, IA: Sioux Gateway Brig Gen Bud Day Field",116.00,16.00,0.00,1.69,8.80,0.00,5.51,16.00,0.00,658.00,0.00,88.00,238.00,0.00,332.00
2019,1,MQ,Envoy Air,SWO,"Stillwater, OK: Stillwater Regional",63.00,4.00,3.72,0.00,0.28,0.00,0.00,2.00,0.00,86.00,80.00,0.00,6.00,0.00,0.00
2019,1,MQ,Envoy Air,SYR,"Syracuse, NY: Syracuse Hancock International",119.00,33.00,5.95,3.02,18.09,0.00,5.94,19.00,0.00,1618.00,396.00,161.00,760.00,0.00,301.00
2019,1,MQ,Envoy Air,TLH,"Tallahassee, FL: Tallahassee International",195.00,41.00,11.03,0.51,15.34,0.00,14.12,1.00,1.00,1963.00,484.00,18.00,507.00,0.00,954.00
2019,1,MQ,Envoy Air,TOL,"Toledo, OH: Toledo Express",80.00,15.00,1.28,2.64,6.14,0.00,4.94,16.00,0.00,531.00,70.00,87.00,174.00,0.00,200.00
2019,1,MQ,Envoy Air,TUL,"Tulsa, OK: Tulsa International",83.00,22.00,3.19,1.34,11.07,0.00,6.40,9.00,0.00,1017.00,141.00,56.00,444.00,0.00,376.00
2019,1,MQ,Envoy Air,TVC,"Traverse City, MI: Cherry Capital",50.00,11.00,1.50,0.30,6.97,0.00,2.23,7.00,0.00,350.00,34.00,16.00,203.00,0.00,97.00
2019,1,MQ,Envoy Air,TXK,"Texarkana, AR: Texarkana Regional-Webb Field",87.00,8.00,1.74,0.70,2.75,0.00,2.81,0.00,0.00,377.00,127.00,51.00,107.00,0.00,92.00
2019,1,MQ,Envoy Air,TYR,"Tyler, TX: Tyler Pounds Regional",116.00,15.00,4.43,0.98,4.09,0.00,5.50,1.00,1.00,589.00,176.00,143.00,103.00,0.00,167.00
2019,1,MQ,Envoy Air,TYS,"Knoxville, TN: McGhee Tyson",138.00,27.00,3.89,0.81,11.56,0.00,10.74,7.00,1.00,1119.00,111.00,49.00,430.00,0.00,529.00
2019,1,MQ,Envoy Air,XNA,"Fayetteville, AR: Northwest Arkansas Regional",344.00,60.00,15.60,3.82,22.37,0.00,18.21,16.00,0.00,2603.00,774.00,202.00,895.00,0.00,732.00
2019,1,NK,Spirit Airlines,ACY,"Atlantic City, NJ: Atlantic City International",298.00,34.00,3.22,1.19,17.71,1.00,10.88,0.00,1.00,2774.00,224.00,52.00,1095.00,39.00,1364.00
2019,1,NK,Spirit Airlines,ATL,"Atlanta, GA: Hartsfield-Jackson Atlanta International",690.00,118.00,18.84,4.80,71.07,2.57,20.72,6.00,0.00,6417.00,1110.00,258.00,3726.00,53.00,1270.00
2019,1,NK,Spirit Airlines,AVL,"Asheville, NC: Asheville Regional",39.00,3.00,0.26,0.00,0.07,0.00,2.67,1.00,0.00,177.00,5.00,0.00,2.00,0.00,170.00
2019,1,NK,Spirit Airlines,BDL,"Hartford, CT: Bradley International",168.00,19.00,6.37,1.00,5.77,0.59,5.27,1.00,0.00,1655.00,699.00,55.00,157.00,16.00,728.00
2019,1,NK,Spirit Airlines,BOS,"Boston, MA: Logan International",399.00,70.00,7.84,2.06,42.67,0.00,17.43,19.00,2.00,6608.00,391.00,335.00,4663.00,0.00,1219.00
2019,1,NK,Spirit Airlines,BQN,"Aguadilla, PR: Rafael Hernandez",56.00,9.00,2.20,0.00,5.80,0.00,1.00,0.00,0.00,970.00,94.00,0.00,233.00,0.00,643.00
2019,1,NK,Spirit Airlines,BWI,"Baltimore, MD: Baltimore/Washington International Thurgood Marshall",646.00,92.00,22.23,1.55,41.83,2.44,23.95,6.00,0.00,7266.00,1520.00,994.00,3082.00,53.00,1617.00
2019,1,NK,Spirit Airlines,CAK,"Akron, OH: Akron-Canton Regional",50.00,8.00,2.39,0.00,2.75,0.00,2.87,2.00,0.00,578.00,70.00,0.00,79.00,0.00,429.00
2019,1,NK,Spirit Airlines,CLE,"Cleveland, OH: Cleveland-Hopkins International",222.00,24.00,5.37,1.52,11.92,0.00,5.19,4.00,0.00,1490.00,228.00,50.00,735.00,0.00,477.00
2019,1,NK,Spirit Airlines,CMH,"Columbus, OH: John Glenn Columbus International",143.00,14.00,3.21,0.21,7.02,0.00,3.56,3.00,0.00,657.00,91.00,12.00,273.00,0.00,281.00
2019,1,NK,Spirit Airlines,DEN,"Denver, CO: Denver International",235.00,44.00,5.85,0.08,25.94,0.00,12.13,0.00,0.00,2794.00,245.00,13.00,1735.00,0.00,801.00
2019,1,NK,Spirit Airlines,DFW,"Dallas/Fort Worth, TX: Dallas/Fort Worth International",569.00,83.00,15.72,0.44,44.83,0.00,22.00,4.00,0.00,6176.00,1640.00,78.00,2361.00,0.00,2097.00
2019,1,NK,Spirit Airlines,DTW,"Detroit, MI: Detroit Metro Wayne County",944.00,118.00,31.52,1.27,58.41,0.00,26.80,17.00,5.00,9356.00,1929.00,804.00,3588.00,0.00,3035.00
2019,1,NK,Spirit Airlines,EWR,"Newark, NJ: Newark Liberty International",304.00,78.00,4.80,0.22,70.07,0.19,2.73,0.00,0.00,6571.00,359.00,35.00,5986.00,5.00,186.00
2019,1,NK,Spirit Airlines,FLL,"Fort Lauderdale, FL: Fort Lauderdale-Hollywood International",1701.00,282.00,42.78,7.81,172.37,0.60,58.44,12.00,0.00,23030.00,4959.00,597.00,11949.00,15.00,5510.00
2019,1,NK,Spirit Airlines,GSO,"Greensboro/High Point, NC: Piedmont Triad International",36.00,5.00,2.00,0.00,1.12,0.00,1.88,0.00,0.00,142.00,54.00,0.00,25.00,0.00,63.00
2019,1,NK,Spirit Airlines,IAG,"Niagara Falls, NY: Niagara Falls International",22.00,5.00,3.25,0.00,1.75,0.00,0.00,1.00,0.00,159.00,100.00,0.00,59.00,0.00,0.00
2019,1,NK,Spirit Airlines,IAH,"Houston, TX: George Bush Intercontinental/Houston",543.00,59.00,10.99,2.13,30.94,0.29,14.65,5.00,0.00,3658.00,677.00,248.00,1506.00,19.00,1208.00
2019,1,NK,Spirit Airlines,JAX,"Jacksonville, FL: Jacksonville International",62.00,8.00,2.00,1.59,3.91,0.00,0.50,2.00,0.00,912.00,244.00,178.00,481.00,0.00,9.00
2019,1,NK,Spirit Airlines,LAS,"Las Vegas, NV: McCarran International",1267.00,184.00,38.29,6.95,93.57,0.21,44.97,8.00,0.00,11887.00,3511.00,385.00,4905.00,4.00,3082.00
2019,1,NK,Spirit Airlines,LAX,"Los Angeles, CA: Los Angeles International",680.00,115.00,17.22,3.54,71.58,0.00,22.67,5.00,0.00,7019.00,2147.00,147.00,3297.00,0.00,1428.00
2019,1,NK,Spirit Airlines,LBE,"Latrobe, PA: Arnold Palmer Regional",81.00,18.00,6.96,0.14,3.56,0.00,7.35,3.00,0.00,854.00,282.00,10.00,117.00,0.00,445.00
2019,1,NK,Spirit Airlines,LGA,"New York, NY: LaGuardia",341.00,105.00,4.54,1.29,94.61,1.46,3.10,10.00,1.00,8266.00,251.00,310.00,7248.00,56.00,401.00
2019,1,NK,Spirit Airlines,MCI,"Kansas City, MO: Kansas City International",132.00,20.00,2.22,1.00,13.14,0.00,3.64,1.00,0.00,741.00,164.00,41.00,403.00,0.00,133.00
2019,1,NK,Spirit Airlines,MCO,"Orlando, FL: Orlando International",1335.00,210.00,37.43,5.12,127.84,0.20,39.41,10.00,0.00,13453.00,2583.00,283.00,5390.00,11.00,5186.00
2019,1,NK,Spirit Airlines,MSP,"Minneapolis, MN: Minneapolis-St Paul International",349.00,45.00,12.36,1.02,16.50,0.00,15.12,11.00,0.00,3078.00,1410.00,60.00,847.00,0.00,761.00
2019,1,NK,Spirit Airlines,MSY,"New Orleans, LA: Louis Armstrong New Orleans International",416.00,52.00,15.32,1.14,22.38,0.00,13.16,4.00,1.00,3277.00,663.00,127.00,1255.00,0.00,1232.00
2019,1,NK,Spirit Airlines,MYR,"Myrtle Beach, SC: Myrtle Beach International",190.00,35.00,8.16,0.27,23.48,1.05,2.04,2.00,0.00,2495.00,842.00,15.00,1486.00,48.00,104.00
2019,1,NK,Spirit Airlines,OAK,"Oakland, CA: Metropolitan Oakland International",165.00,19.00,2.54,0.23,11.57,0.00,4.67,0.00,0.00,1064.00,125.00,6.00,543.00,0.00,390.00
2019,1,NK,Spirit Airlines,ORD,"Chicago, IL: Chicago O'Hare International",734.00,169.00,30.03,9.67,102.04,0.00,27.26,34.00,0.00,19955.00,2417.00,4226.00,11015.00,0.00,2297.00
2019,1,NK,Spirit Airlines,PBG,"Plattsburgh, NY: Plattsburgh International",21.00,0.00,0.00,0.00,0.00,0.00,0.00,1.00,0.00,0.00,0.00,0.00,0.00,0.00,0.00
2019,1,NK,Spirit Airlines,PBI,"West Palm Beach/Palm Beach, FL: Palm Beach International",79.00,18.00,5.56,0.20,7.07,0.00,5.18,2.00,0.00,1267.00,614.00,32.00,316.00,0.00,305.00
2019,1,NK,Spirit Airlines,PDX,"Portland, OR: Portland International",55.00,8.00,2.42,0.00,3.00,0.00,2.58,0.00,1.00,503.00,202.00,0.00,189.00,0.00,112.00
2019,1,NK,Spirit Airlines,PHL,"Philadelphia, PA: Philadelphia International",284.00,40.00,11.00,0.00,16.10,1.59,11.31,1.00,0.00,2864.00,1143.00,0.00,820.00,48.00,853.00
2019,1,NK,Spirit Airlines,PHX,"Phoenix, AZ: Phoenix Sky Harbor International",93.00,17.00,2.75,1.20,5.56,0.00,7.49,3.00,0.00,1802.00,170.00,898.00,252.00,0.00,482.00
2019,1,NK,Spirit Airlines,PIT,"Pittsburgh, PA: Pittsburgh International",180.00,18.00,5.14,0.00,7.24,0.11,5.50,0.00,0.00,2312.00,321.00,0.00,354.00,4.00,1633.00
2019,1,NK,Spirit Airlines,RIC,"Richmond, VA: Richmond International",62.00,7.00,1.71,0.00,1.33,0.00,3.96,0.00,0.00,553.00,54.00,0.00,105.00,0.00,394.00
2019,1,NK,Spirit Airlines,RSW,"Fort Myers, FL: Southwest Florida International",493.00,87.00,15.57,4.83,57.15,0.00,9.45,9.00,2.00,6084.00,1190.00,323.00,3537.00,0.00,1034.00
2019,1,NK,Spirit Airlines,SAN,"San Diego, CA: San Diego International",143.00,25.00,3.73,0.00,10.63,0.00,10.64,1.00,0.00,1314.00,128.00,0.00,357.00,0.00,829.00
2019,1,NK,Spirit Airlines,SEA,"Seattle, WA: Seattle/Tacoma International",103.00,13.00,4.52,0.00,6.71,0.00,1.78,0.00,0.00,649.00,270.00,0.00,312.00,0.00,67.00
2019,1,NK,Spirit Airlines,SJU,"San Juan, PR: Luis Munoz Marin International",193.00,36.00,10.45,0.06,17.52,0.00,7.97,0.00,0.00,1307.00,343.00,7.00,539.00,0.00,418.00
2019,1,NK,Spirit Airlines,STT,"Charlotte Amalie, VI: Cyril E King",45.00,2.00,0.09,0.00,0.91,0.00,1.00,0.00,0.00,100.00,7.00,0.00,75.00,0.00,18.00
2019,1,NK,Spirit Airlines,TPA,"Tampa, FL: Tampa International",654.00,67.00,14.54,4.80,36.47,0.00,11.20,11.00,1.00,3367.00,663.00,496.00,1349.00,0.00,859.00
2019,1,OH,PSA Airlines Inc.,ABE,"Allentown/Bethlehem/Easton, PA: Lehigh Valley International",85.00,13.00,6.99,0.00,3.36,0.00,2.66,6.00,0.00,607.00,472.00,0.00,68.00,0.00,67.00
2019,1,OH,PSA Airlines Inc.,AGS,"Augusta, GA: Augusta Regional at Bush Field",115.00,9.00,4.24,0.00,1.25,0.00,3.51,0.00,0.00,359.00,180.00,0.00,28.00,0.00,151.00
2019,1,OH,PSA Airlines Inc.,ALB,"Albany, NY: Albany International",115.00,33.00,11.83,2.37,6.21,1.00,11.59,10.00,1.00,2301.00,804.00,235.00,259.00,30.00,973.00
2019,1,OH,PSA Airlines Inc.,ART,"Watertown, NY: Watertown International",62.00,10.00,3.95,2.00,2.21,0.00,1.84,16.00,3.00,507.00,113.00,203.00,53.00,0.00,138.00
2019,1,OH,PSA Airlines Inc.,ATL,"Atlanta, GA: Hartsfield-Jackson Atlanta International",145.00,23.00,7.39,0.00,10.42,0.00,5.19,2.00,0.00,1246.00,444.00,0.00,516.00,0.00,286.00
2019,1,OH,PSA Airlines Inc.,AVL,"Asheville, NC: Asheville Regional",178.00,18.00,8.71,2.33,5.90,0.00,1.07,8.00,2.00,768.00,273.00,307.00,165.00,0.00,23.00
2019,1,OH,PSA Airlines Inc.,AVP,"Scranton/Wilkes-Barre, PA: Wilkes Barre Scranton International",92.00,11.00,3.81,0.00,3.58,0.00,3.61,4.00,0.00,249.00,87.00,0.00,68.00,0.00,94.00
2019,1,OH,PSA Airlines Inc.,BDL,"Hartford, CT: Bradley International",184.00,32.00,11.88,0.37,6.97,0.00,12.78,15.00,2.00,1759.00,734.00,23.00,271.00,0.00,731.00
2019,1,OH,PSA Airlines Inc.,BGR,"Bangor, ME: Bangor International",47.00,14.00,4.74,1.05,4.17,0.10,3.94,5.00,0.00,664.00,140.00,97.00,125.00,7.00,295.00
2019,1,OH,PSA Airlines Inc.,BHM,"Birmingham, AL: Birmingham-Shuttlesworth International",258.00,43.00,16.41,0.34,15.03,0.00,11.21,5.00,0.00,1977.00,730.00,20.00,428.00,0.00,799.00
2019,1,OH,PSA Airlines Inc.,BNA,"Nashville, TN: Nashville International",104.00,8.00,1.91,0.00,1.27,0.00,4.82,4.00,0.00,371.00,92.00,0.00,87.00,0.00,192.00
2019,1,OH,PSA Airlines Inc.,BTR,"Baton Rouge, LA: Baton Rouge Metropolitan/Ryan Field",27.00,5.00,1.68,0.00,0.61,0.00,2.71,0.00,0.00,323.00,68.00,0.00,27.00,0.00,228.00
2019,1,OH,PSA Airlines Inc.,BTV,"Burlington, VT: Burlington International",94.00,13.00,2.34,0.12,4.12,0.00,6.43,10.00,0.00,715.00,63.00,27.00,109.00,0.00,516.00
2019,1,OH,PSA Airlines Inc.,BUF,"Buffalo, NY: Buffalo Niagara International",32.00,3.00,1.00,0.00,0.62,0.00,1.38,3.00,0.00,69.00,19.00,0.00,21.00,0.00,29.00
2019,1,OH,PSA Airlines Inc.,BWI,"Baltimore, MD: Baltimore/Washington International Thurgood Marshall",9.00,1.00,1.00,0.00,0.00,0.00,0.00,1.00,0.00,18.00,18.00,0.00,0.00,0.00,0.00
2019,1,OH,PSA Airlines Inc.,CAE,"Columbia, SC: Columbia Metropolitan",203.00,29.00,9.95,0.75,7.76,0.00,10.54,3.00,0.00,1508.00,444.00,47.00,342.00,0.00,675.00
2019,1,OH,PSA Airlines Inc.,CAK,"Akron, OH: Akron-Canton Regional",261.00,57.00,19.34,0.24,10.35,0.00,27.07,3.00,2.00,3672.00,1044.00,4.00,341.00,0.00,2283.00
2019,1,OH,PSA Airlines Inc.,CHA,"Chattanooga, TN: Lovell Field",171.00,29.00,11.57,0.00,3.97,0.00,13.46,2.00,0.00,1570.00,681.00,0.00,102.00,0.00,787.00
2019,1,OH,PSA Airlines Inc.,CHO,"Charlottesville, VA: Charlottesville Albemarle",117.00,10.00,3.67,2.78,1.56,0.00,1.99,2.00,0.00,659.00,166.00,376.00,41.00,0.00,76.00
2019,1,OH,PSA Airlines Inc.,CHS,"Charleston, SC: Charleston AFB/International",258.00,31.00,13.27,0.00,7.76,0.84,9.13,5.00,0.00,1661.00,703.00,0.00,280.00,16.00,662.00
2019,1,OH,PSA Airlines Inc.,CID,"Cedar Rapids/Iowa City, IA: The Eastern Iowa",63.00,2.00,1.00,0.00,1.00,0.00,0.00,2.00,0.00,224.00,193.00,0.00,31.00,0.00,0.00
2019,1,OH,PSA Airlines Inc.,CLE,"Cleveland, OH: Cleveland-Hopkins International",228.00,34.00,13.10,3.12,7.68,0.00,10.09,3.00,1.00,1989.00,890.00,214.00,290.00,0.00,595.00
2019,1,OH,PSA Airlines Inc.,CLT,"Charlotte, NC: Charlotte Douglas International",7377.00,842.00,205.54,35.89,245.09,1.94,353.54,149.00,3.00,49584.00,17306.00,2305.00,7704.00,57.00,22212.00
2019,1,OH,PSA Airlines Inc.,CMH,"Columbus, OH: John Glenn Columbus International",108.00,29.00,7.37,0.63,6.37,0.00,14.62,3.00,0.00,1238.00,449.00,17.00,193.00,0.00,579.00
2019,1,OH,PSA Airlines Inc.,CRW,"Charleston/Dunbar, WV: Yeager",197.00,49.00,16.75,3.27,5.38,0.00,23.60,7.00,3.00,2480.00,870.00,165.00,180.00,0.00,1265.00
2019,1,OH,PSA Airlines Inc.,CVG,"Cincinnati, OH: Cincinnati/Northern Kentucky International",391.00,46.00,13.68,0.82,12.71,0.27,18.51,3.00,0.00,2231.00,706.00,115.00,434.00,15.00,961.00
2019,1,OH,PSA Airlines Inc.,DAB,"Daytona Beach, FL: Daytona Beach International",133.00,19.00,6.16,0.00,9.43,0.00,3.41,0.00,0.00,554.00,161.00,0.00,266.00,0.00,127.00
2019,1,OH,PSA Airlines Inc.,DAY,"Dayton, OH: James M Cox/Dayton International",571.00,117.00,27.00,11.67,26.92,0.00,51.41,29.00,1.00,7257.00,1632.00,633.00,1064.00,0.00,3928.00
2019,1,OH,PSA Airlines Inc.,DCA,"Washington, DC: Ronald Reagan Washington National",2673.00,514.00,103.44,21.79,140.87,1.44,246.46,189.00,7.00,36665.00,7888.00,1947.00,6316.00,134.00,20380.00
2019,1,OH,PSA Airlines Inc.,DSM,"Des Moines, IA: Des Moines International",116.00,21.00,7.50,0.40,9.34,0.00,3.77,6.00,0.00,1005.00,316.00,52.00,326.00,0.00,311.00
2019,1,OH,PSA Airlines Inc.,DTW,"Detroit, MI: Detroit Metro Wayne County",107.00,10.00,3.04,0.19,3.38,0.00,3.38,6.00,0.00,948.00,272.00,16.00,186.00,0.00,474.00
2019,1,OH,PSA Airlines Inc.,EVV,"Evansville, IN: Evansville Regional",33.00,7.00,3.12,1.00,1.00,0.00,1.88,0.00,0.00,464.00,165.00,22.00,19.00,0.00,258.00
2019,1,OH,PSA Airlines Inc.,EWN,"New Bern/Morehead/Beaufort, NC: Coastal Carolina Regional",126.00,18.00,6.00,0.00,3.72,0.00,8.28,2.00,0.00,758.00,311.00,0.00,75.00,0.00,372.00
2019,1,OH,PSA Airlines Inc.,FAY,"Fayetteville, NC: Fayetteville Regional/Grannis Field",101.00,15.00,8.51,0.00,2.40,0.00,4.08,0.00,0.00,579.00,270.00,0.00,50.00,0.00,259.00
2019,1,OH,PSA Airlines Inc.,GNV,"Gainesville, FL: Gainesville Regional",111.00,11.00,4.17,0.00,2.20,0.00,4.63,1.00,0.00,375.00,151.00,0.00,46.00,0.00,178.00
2019,1,OH,PSA Airlines Inc.,GPT,"Gulfport/Biloxi, MS: Gulfport-Biloxi International",61.00,4.00,1.05,0.00,0.71,0.36,1.89,0.00,0.00,304.00,63.00,0.00,60.00,30.00,151.00
2019,1,OH,PSA Airlines Inc.,GRR,"Grand Rapids, MI: Gerald R. Ford International",115.00,22.00,3.61,1.44,6.18,0.00,10.77,16.00,1.00,1638.00,293.00,112.00,314.00,0.00,919.00
2019,1,OH,PSA Airlines Inc.,GSO,"Greensboro/High Point, NC: Piedmont Triad International",272.00,52.00,21.31,1.08,5.88,0.00,23.72,7.00,0.00,2788.00,1141.00,56.00,219.00,0.00,1372.00
2019,1,OH,PSA Airlines Inc.,GSP,"Greer, SC: Greenville-Spartanburg International",416.00,66.00,20.64,1.34,13.69,0.00,30.33,3.00,0.00,3546.00,1109.00,111.00,359.00,0.00,1967.00
2019,1,OH,PSA Airlines Inc.,HPN,"White Plains, NY: Westchester County",259.00,61.00,20.27,2.14,14.33,0.60,23.66,24.00,4.00,3486.00,1472.00,234.00,550.00,15.00,1215.00
2019,1,OH,PSA Airlines Inc.,HSV,"Huntsville, AL: Huntsville International-Carl T Jones Field",133.00,17.00,6.53,0.00,1.59,0.00,8.88,0.00,0.00,886.00,302.00,0.00,45.00,0.00,539.00
2019,1,OH,PSA Airlines Inc.,HVN,"New Haven, CT: Tweed New Haven",69.00,12.00,5.27,0.00,2.10,0.00,4.63,5.00,1.00,1151.00,300.00,0.00,80.00,0.00,771.00
2019,1,OH,PSA Airlines Inc.,IAD,"Washington, DC: Washington Dulles International",156.00,23.00,7.78,0.00,8.08,0.00,7.14,0.00,1.00,684.00,269.00,0.00,224.00,0.00,191.00
2019,1,OH,PSA Airlines Inc.,IAH,"Houston, TX: George Bush Intercontinental/Houston",22.00,5.00,1.97,0.00,3.03,0.00,0.00,0.00,0.00,132.00,60.00,0.00,72.00,0.00,0.00
2019,1,OH,PSA Airlines Inc.,ILM,"Wilmington, NC: Wilmington International",215.00,26.00,9.49,1.00,6.38,0.00,9.13,2.00,0.00,1075.00,380.00,31.00,122.00,0.00,542.00
2019,1,OH,PSA Airlines Inc.,IND,"Indianapolis, IN: Indianapolis International",153.00,24.00,9.77,1.35,6.48,0.00,6.39,4.00,1.00,1418.00,712.00,72.00,202.00,0.00,432.00
2019,1,OH,PSA Airlines Inc.,ITH,"Ithaca/Cortland, NY: Ithaca Tompkins Regional",4.00,2.00,0.88,0.00,0.92,0.00,0.19,0.00,0.00,122.00,51.00,0.00,60.00,0.00,11.00
2019,1,OH,PSA Airlines Inc.,JAN,"Jackson/Vicksburg, MS: Jackson Medgar Wiley Evers International",140.00,25.00,12.86,0.42,8.42,0.00,3.30,0.00,0.00,1458.00,744.00,110.00,286.00,0.00,318.00
2019,1,OH,PSA Airlines Inc.,JAX,"Jacksonville, FL: Jacksonville International",75.00,10.00,4.70,0.00,1.35,0.00,3.95,1.00,1.00,358.00,148.00,0.00,74.00,0.00,136.00
2019,1,OH,PSA Airlines Inc.,JFK,"New York, NY: John F. Kennedy International",72.00,8.00,1.18,0.25,2.70,0.00,3.87,3.00,0.00,737.00,118.00,27.00,179.00,0.00,413.00
2019,1,OH,PSA Airlines Inc.,LAN,"Lansing, MI: Capital Region International",26.00,4.00,1.73,0.21,0.98,0.00,1.09,3.00,0.00,457.00,282.00,13.00,103.00,0.00,59.00
2019,1,OH,PSA Airlines Inc.,LEX,"Lexington, KY: Blue Grass",103.00,13.00,3.05,0.49,2.41,0.00,7.04,3.00,0.00,621.00,223.00,15.00,76.00,0.00,307.00
2019,1,OH,PSA Airlines Inc.,LGA,"New York, NY: LaGuardia",149.00,59.00,5.89,1.75,33.75,0.53,17.08,6.00,2.00,4222.00,295.00,92.00,2415.00,10.00,1410.00
2019,1,OH,PSA Airlines Inc.,LIT,"Little Rock, AR: Bill and Hillary Clinton Nat Adams Field",104.00,10.00,4.41,0.00,3.59,0.00,2.00,1.00,0.00,317.00,167.00,0.00,78.00,0.00,72.00
2019,1,OH,PSA Airlines Inc.,LYH,"Lynchburg, VA: Lynchburg Regional/Preston Glenn Field",49.00,3.00,1.00,0.00,0.00,0.00,2.00,2.00,0.00,167.00,15.00,0.00,0.00,0.00,152.00
2019,1,OH,PSA Airlines Inc.,MCI,"Kansas City, MO: Kansas City International",32.00,2.00,0.28,0.00,0.00,0.00,1.72,0.00,0.00,107.00,19.00,0.00,0.00,0.00,88.00
2019,1,OH,PSA Airlines Inc.,MDT,"Harrisburg, PA: Harrisburg International",57.00,3.00,1.53,0.00,0.31,0.00,1.16,4.00,0.00,103.00,52.00,0.00,10.00,0.00,41.00
2019,1,OH,PSA Airlines Inc.,MEM,"Memphis, TN: Memphis International",124.00,11.00,2.79,0.00,4.27,0.00,3.94,1.00,0.00,350.00,132.00,0.00,93.00,0.00,125.00
2019,1,OH,PSA Airlines Inc.,MGM,"Montgomery, AL: Montgomery Regional",26.00,5.00,1.11,0.56,0.00,0.00,3.32,1.00,0.00,516.00,59.00,44.00,0.00,0.00,413.00
2019,1,OH,PSA Airlines Inc.,MHT,"Manchester, NH: Manchester-Boston Regional",113.00,14.00,4.24,0.73,7.57,0.00,1.46,8.00,0.00,642.00,200.00,90.00,176.00,0.00,176.00
2019,1,OH,PSA Airlines Inc.,MKE,"Milwaukee, WI: General Mitchell International",146.00,16.00,4.90,0.77,2.77,0.00,7.57,5.00,0.00,790.00,208.00,59.00,132.00,0.00,391.00
2019,1,OH,PSA Airlines Inc.,MLB,"Melbourne, FL: Melbourne International",93.00,15.00,7.19,0.00,2.34,0.00,5.48,0.00,0.00,761.00,506.00,0.00,40.00,0.00,215.00
2019,1,OH,PSA Airlines Inc.,MOB,"Mobile, AL: Mobile Regional",18.00,6.00,1.96,0.00,3.76,0.00,0.27,0.00,1.00,170.00,74.00,0.00,87.00,0.00,9.00
2019,1,OH,PSA Airlines Inc.,MSN,"Madison, WI: Dane County Regional-Truax Field",113.00,14.00,2.86,0.00,4.63,0.00,6.51,4.00,0.00,1029.00,169.00,0.00,151.00,0.00,709.00
2019,1,OH,PSA Airlines Inc.,MSY,"New Orleans, LA: Louis Armstrong New Orleans International",7.00,2.00,0.00,0.00,0.35,0.00,1.65,1.00,0.00,167.00,0.00,0.00,11.00,0.00,156.00
2019,1,OH,PSA Airlines Inc.,MYR,"Myrtle Beach, SC: Myrtle Beach International",236.00,20.00,10.14,0.60,2.06,0.00,7.20,1.00,0.00,893.00,350.00,63.00,103.00,0.00,377.00
2019,1,OH,PSA Airlines Inc.,OAJ,"Jacksonville/Camp Lejeune, NC: Albert J Ellis",174.00,26.00,8.68,0.84,8.08,0.00,8.40,1.00,1.00,796.00,203.00,28.00,216.00,0.00,349.00
2019,1,OH,PSA Airlines Inc.,OKC,"Oklahoma City, OK: Will Rogers World",36.00,3.00,0.93,0.00,1.09,0.00,0.99,0.00,1.00,189.00,24.00,0.00,29.00,0.00,136.00
2019,1,OH,PSA Airlines Inc.,OMA,"Omaha, NE: Eppley Airfield",62.00,12.00,5.38,0.00,4.71,0.00,1.91,1.00,0.00,434.00,182.00,0.00,164.00,0.00,88.00
2019,1,OH,PSA Airlines Inc.,ORD,"Chicago, IL: Chicago O'Hare International",140.00,16.00,6.98,0.34,5.67,0.00,3.00,22.00,0.00,721.00,234.00,11.00,339.00,0.00,137.00
2019,1,OH,PSA Airlines Inc.,ORF,"Norfolk, VA: Norfolk International",435.00,71.00,22.49,2.33,22.14,0.00,24.05,2.00,0.00,3701.00,1398.00,79.00,812.00,0.00,1412.00
2019,1,OH,PSA Airlines Inc.,PHF,"Newport News/Williamsburg, VA: Newport News/Williamsburg International",30.00,4.00,2.21,0.00,0.58,0.00,1.21,0.00,0.00,112.00,78.00,0.00,11.00,0.00,23.00
2019,1,OH,PSA Airlines Inc.,PHL,"Philadelphia, PA: Philadelphia International",1226.00,196.00,52.85,9.97,50.62,0.64,81.91,33.00,0.00,14471.00,5023.00,900.00,2116.00,16.00,6416.00
2019,1,OH,PSA Airlines Inc.,PIA,"Peoria, IL: General Downing - Peoria International",62.00,14.00,4.27,0.00,6.99,0.00,2.74,6.00,1.00,664.00,326.00,0.00,191.00,0.00,147.00
2019,1,OH,PSA Airlines Inc.,PIT,"Pittsburgh, PA: Pittsburgh International",169.00,27.00,13.24,2.02,4.87,1.00,5.87,1.00,1.00,1795.00,981.00,204.00,192.00,16.00,402.00
2019,1,OH,PSA Airlines Inc.,PNS,"Pensacola, FL: Pensacola International",155.00,29.00,8.62,0.00,9.63,0.00,10.75,3.00,0.00,1558.00,556.00,0.00,320.00,0.00,682.00
